artist,genre
Simón Díaz,"venezuela, llanera, latin, folk, latinos, venezuelan, composer, 80s, Joropo, male vocalists"
"Ceca, Tropico Band",
Tina Arena,"pop, female vocalists, australian, rock, singer-songwriter, Aussie, french, female, Tina Arena, alternative"
Mad Tribe,"psytrance, full on, psychedelic, electronic, neo full-on, hi-tech psytrance, psychedelic trance, mind blowing psytrance"
PW & friends,
Captain Capa,"electronic, german, Electroclash, electro, audiolith, electropunk, electropop, germany, seenlive, All"
Jumo,"future beats, beats, french, electronic, hip hop, experimental, dance, wonky, future bass, france"
Lamb,"trip-hop, electronic, chillout, female vocalists, electronica, downtempo, british, trip hop, ambient, Drum and bass"
Bob Mould,"alternative, singer-songwriter, rock, alternative rock, indie, indie rock, USA, american, new york, college rock"
Mc Marechal,"Rap Nacional, rap, rio de janeiro, Hip-Hop, underground hip-hop, Quinto Andar, hip hop, alternative, brasil, brazilian"
Jean-François Malo,
Candlebox,"Grunge, alternative rock, rock, 90s, alternative, post-grunge, hard rock, seattle, Candlebox, Grunge Rock"
"Demian Rodríguez, Pascuala Ilabaca",
Mojiganga,"ska punk, ska, Ska Core, punk, Colombia, skacore, punk rock, colombian, Rock colombiano, SkaDeMedellin"
Marvin Pontiac,"blues, jazz, singer-songwriter, free jazz, Post-Bop, john lurie, fake jazz, lounge, african jew blues, acoustic"
Peter Nagy,"rock, slovak, pop, 80s, 90s, slovakia, pop rock, All, frajer, piano"
Tito Puente,"salsa, latin, latin jazz, jazz, mambo, tito puente, percussion, Afro-Cuban Jazz, world, USA"
The The,"new wave, post-punk, alternative, 80s, indie, british, alternative rock, rock, synthpop, UK"
Jackal,"heavy metal, trap, Power metal, Traditional Metal, electronic, 80s, hardcore, hardcore punk, danish metal, rock"
Jantony,"urban, latin, trap, puerto rico, Latin Urban, Latin Trap"
Navarone,"rock, dutch, hard rock, Psychedelic Rock, netherlands, the netherlands, Nijmegen, psychedelic, blues, classic rock"
Paris Blohm,"electro house, Progressive House, big room house, House, All, USA, electronic, us, United States, trap"
"Zooey Deschanel, Anna Kendrick, Gwen Stefani, James Corden, Walt Dohrn, Ron Funches, Caroline Hjelt, Aino Jawo, Kunal Nayyar",
ORI,"ambient, electronica, folk, psychedelic, folktronica, electronic, experimental, avant garde, Israel, indie"
"Chilly Gonzales, Jarvis Cocker",
Quantic Presenta: Flowering Inferno,"dub, reggae, downtempo, tru thoughts, dub reggae, latin, Quantic, chillout, dub electronica, afrolatin groove"
JJ Vineberg,
"米非, Suming",
Brahny,"synthpop, Canadian, funk_add_to_lidarr_batch_4, alternative rnb"
Heavy Tiger,"hard rock, rock, Sweden, swedish, great discovery, s, sleazy rock, Little Gem, All female rock band, oldschool heavy metal"
"-M-, Toumani Diabaté, Sidiki Diabaté",
Saint300,
"Die Kraszesten, doZ9, Pierre Sonality",
"Niconé, Sascha Braemer",
"Gamma, Chelsea",
"Clueso, Kat Frankie",
Rare Bird,"Progressive rock, classic rock, art rock, rock, Progressive, british, 70s, Psychedelic Rock, 60s, Crossover Prog"
Simple Plan,"pop punk, punk rock, rock, punk, emo, Canadian, alternative, alternative rock, pop rock, simple plan"
Notaker,"synthwave, midtempo bass, progressive trance, Progressive House, Worlds Vibes, wonky, nu-disco, Cinematic Classical, breaks, monstercat"
"Atmozfears, David Spekter",
Baloji,"Belgium, Hip-Hop, rap, belgian, congo, hip hop, All, african, soul, french"
"Tibério Azul, Clarice Falcão",
"Kattê, Claudia Leitte",
Mandragora,"Melodic Death Metal, death metal, lithuanian, Lithuanian metal, psytrance, trance, metal, lithuania, space rock, psychedelic"
"Terrell Morris, Free n Losh",
Riot Ten,"trap, american, trapstep, dubstep, electronic, texas, hardcore, United States, numbers, ass"
"Levi, Victor Perry",
Peter Silberman,"indie rock, slowcore, post-rock, rock, ambient, indie, singer-songwriter, genius, kentsimbtemp2, USA"
Andréanne A. Malette,"Canadian, female singer, québec"
Jauz,"House, electronic, trap, american, dance, USA, electro, bass, All, EDM"
Koreless,"future garage, dubstep, electronic, 2-step, UK Garage, british, All, post-dubstep, ambient, experimental"
"YOO YOUNG JIN, D.O.",
Bantum,"electronic, pop, All, shoegaze, under 2000 listeners, witch house, chillwave, Bandcamp"
Burning Spear,"reggae, roots reggae, dub, jamaican, roots, jamaica, Burning Spear, Rasta, rastafari, political reggae"
lecca,"japanese, reggae, j-pop, dancehall, female vocalists, Japanese Reggae, j-reggae, JPop, Better than ayumi and koda put together, j-urban"
Dirty Loops,"funk, Fusion, jazz, pop, experimental, swedish, jazz fusion, Progressive rock, rnb, pop rock"
"Dodge & Fuski, Far Too Loud, Beardyman, JFB",
"2 Chainz, Gucci Mane, Quavo, The Trap Choir",
Wet Baes,"vaporwave, chillwave, synthpop, synthwave, funk, synth pop, indie rock, mexico, Disco, chill"
Red&White Crowd,
Rob Van Daal,levenslied
Curate Music,
Texture Like Sun,"indie, folk, indie folk"
"Andra, Dony, Matteo",
"Sean Paul, Keyshia Cole","rnb, dancehall, Soundtrack, reggae, american, jamaican, jamaica, mistagged artist"
Alzbeta Koleckarova,czech singer
"Gatekunst, Satilmis, Turab, Ezzari",
Les Petit Bâtards,
Fobia,"Rock en Espanol, rock, rock en español, mexico, Latin Rock, rock mexicano, spanish, Fobia, alternative rock, 90s"
"Getter Jaani, Grete Paia, Uku Suviste",
VANT,"indie rock, indie, UK, british, england, All, my top songs, indie pop, punk, free jazz"
"Dmitri Shostakovich, Yuri Torchinsky, Peter Dixon, BBC Philharmonic, Vassily Sinaisky",
Tommy Tokyo & Starving For My Gravy,"norwegian, indie pop, singer-songwriter, rock, scandinavian, alternative rock, alternative, Check out more, norsk, blues rock"
Diamond Head,"heavy metal, NWOBHM, hard rock, metal, New Wave of British Heavy Metal, british, rock, 80s, 12, classic rock"
Salvador y el Unicornio,"pop, indie, mexico, rock, Alternativo, male vocalists, acoustic, 10s, indie pop alternativo, jalisco"
"Klahr, KEV",
"La Banda Baston, McKlopedia",
Written by Wolves,"alternative rock, New Zealand, rock, modern rock, my top songs, alternative, alt-rock, industrial rock, rock-dance, new zealander rock"
Rob Dougan,"electronic, trip-hop, Soundtrack, chillout, electronica, instrumental, ambient, australian, downtempo, Hann with Gun"
"Mean, Judo",
"Pyotr Ilyich Tchaikovsky, London Symphony Orchestra, André Previn",
"Fallgrapp, Juraj Benetin",
Banda de Cornetas y Tambores Ntra. Sra. de la Victoria,
GRAY,"experimental, doujin ongaku, Basquiat, touhou, japanese, electronica, ambient, Drum and bass, doujin, Ambient Techno"
"Niall Horan, Anne-Marie",UK
"Hef, Jayh",
"DJ DYLVN, Caza, Zefanio, Defano Holwijn",
"Guè, Dj Harsh",
Lost In France,
"Aleman, Lolita Ayala",
"Aleman, Cartel De Santa",
"Aleman, Rels B",
"Aleman, Santa Fe Klan",
"Aleman, Elote el Barbaro",
"Aleman, Junior H, Adan Cruz",
"PHAM, Maddison Williams",
"Bokoesam, Bartofso",
"Latifah, Monsif, Dopebwoy",
"Seeb, Nina Nesbitt",
Famy,"indie, alternative, New band of the day, indie pop"
Gösta Ekman,svensk taggradio
"Jacksepticeye, The Gregory Brothers",
Miss E,"Hip-Hop, rap, rnb, female vocalists, hip hop, american, pop, dance, 90s, Missy Elliott"
Ian van Dahl,"trance, dance, vocal trance, electronic, techno, belgian, female vocalists, eurodance, electronica, House"
Smoove,"acid jazz, funk, breakbeat, modern funk, electronica, electronic, jazz, soul, Hip-Hop, turntablism"
bailey,"hard rock, Drum n Bass, Drum and bass, melodic rock, electronic, progressive trance, trance, Bay Area, melodic hard rock, hardcore"
Bryce Fox,"rock, electronic, alternative, american, my top songs"
Tiara Thomas,"rnb, Hip-Hop, r&b, rap, female vocalists, hip hop, chill, us, rico love, Indiana"
Brown Bird,"folk, singer-songwriter, acoustic, americana, Slow-coustic, american, Mellow, indie folk, Alt-country, country"
Li Zhi,"folk, chinese, indie rock"
Hamish Anderson,"australian, blues rock, australia, blues, sxsw 2017, Passion of Discovery"
Gündoğarken,"slow, turkish, kent muzigi, Turkish Pop, gundoga"
Modern Folk Üçlüsü,"folk, turkish, folk pop, turkey, turkish folk, Turkish Pop"
Romar,"minimal, pop, electronic, House, minimal techno, tech house, male vocalists"
"Leaf Dog, Phi Life Cypher, Smellington Piff, BVA, Cracker Jon, Jehst, Jack Jetson, Dirty Dike, Verb T, SonnyJim, Mysdiggi, Klashnekoff, Fliptrix, Bill Shakes, Eric the Red, King Kashmere, Remus, Task Force, DJ Sammy B-Side",
Lorentz & Sakarias,"swedish, rap, Hip-Hop, hip hop, All, pop, electronic, experimental, svenskt, alternative"
"Phenom, Boosie Badazz, Mozzy",
WITHOUT,"hardcore punk, hardcore, black metal, Doom, doom metal, Sludge, alternative rock, Nu-metal, post-rock, punk rock"
Cruzando El Charco,"rock, alternative rock, pop rock, indie rock, la plata, argentina, buenos aires province"
The Bubbles,"Oi, streetpunk, rock, Garage Punk, street punk, punk, Garage Rock, Skinhead, Psychedelic Rock, psychedelic"
"Negroman, Anthony Drawn",
"Mollono.Bass, Ava Asante","german, House, techno, electronic, electro, miniml, tech-house"
"Murdock, Jenna G",
Townes Van Zandt,"folk, country, singer-songwriter, americana, Alt-country, Nashville, Recommended, pay attention, indie, kickasstic"
Octavia,"Gothic Metal, bolivia, Rock Boliviano, rock, Female fronted metal, metal, norwegian, heavy metal, Gothic, Rock en Espanol"
"Mylene Cruz (Herizen Guardiola) & The Soul Madonnas, The Soul Madonnas",
Ventania.records,"reggae, hippie"
Beloslava,"chillout, female vocalists, jazz, bulgarian, seen live-sunflower983, bulagiran love jazz, BG"
"KeKe Wyatt, Avant",
Swiperboy,
Nine Days,"alternative rock, rock, alternative, pop rock, pop, power pop, american, Scatterbrain Favorites, 90s, male vocalists"
Information Society,"synthpop, new wave, 80s, electronic, synth pop, dance, industrial, freestyle, electro, electronica"
Devin Townsend Project,"Progressive metal, Progressive rock, experimental, ambient, Progressive, metal, Canadian, industrial metal, Devin Townsend, rock"
The Contortionist,"deathcore, Progressive deathcore, Progressive metal, experimental, Progressive, metalcore, DJENT, progressive death metal, metal, Progressive Metalcore"
"Louane, Tristan Salvati",
"Janek Ledecky, Peter Nagy, JooRa",
"L'One, Varvara Vizbor",
Michal David,"Czech, Disco, pop, 80s, dance, happy dance, Czech Republic, czechoslovakia, czechoslovak, hardcore"
EXGF,"All, electronic, electronica, dance, USA"
"Yung Coke, Guacamole Niller",
Simo Salminen,"humour, finnish, comedy, finland, iskelma, All, singer-songwriter, huumori, SuomiPop, paskaa"
Kontra,"finnish, rock, Sarajevo, RAC, hardcore bosnian hardcore, punk, hardcore, croatian, Bosnian, hardcore punk"
Eero Raittinen,"finnish, rock, blues, finland, blues rock, Suomi, iskelma, singer-songwriter, hard rock, 70s"
Joël,"dub, downtempo, chill"
Coastline Kings,
Sunny V,
"Adele, The Raconteurs",
Kid,"electronic, 8-bit, indie, pop, electropop, USA, Electroclash, Kitsune, new rave, ost"
Haste The Day,"metalcore, hardcore, christian, screamo, metal, Christian Metalcore, melodic metalcore, post-hardcore, american, emocore"
Shogun,"trance, progressive trance, metalcore, electronic, hardcore, Drum and bass, vocal trance, hard rock, NWOBHM, heavy metal"
Kiso,"american, experimental"
"Singto Numchok, Yb (Young Bong), ว่าน วันวาน",
"Delara, ADAAM, Robbz x Brookz",
All For Nothing,"hardcore, hardcore punk, female vocalists, female fronted hardcore, oldschool hardcore, dutch, melodic hardcore, punk, punk rock, female vocalist"
Claptone,"House, deep house, electronic, nu disco, Disco, electronica, Berlin, Lo-Fi, indietronica, liquid funk"
DAY6 데이식스,"Kpop, south korea"
The Milk Carton Kids,"folk, indie, Alt-country, singer-songwriter, indie folk, american, americana, California, alternative, country"
The New Social,
David Crosby,"folk rock, singer-songwriter, classic rock, folk, rock, american, 70s, 60s, david crosby, CSNY"
New Found Glory,"pop punk, punk rock, punk, rock, emo, Pop-punk, alternative, melodic hardcore, Easycore, alternative rock"
Ryugo Ishida,"Hip-Hop, japanese hip-hop"
Elektronomia,"House, electronic, electro, dance, finnish, finland, electronica, electro house, Progressive House, EDM"
Justs,"latvian, pop, favourites from eurovision, Eurovision, Eurovision 2016, latvia, dance, male vocalists, Eurovision Song Contest, electronica"
Scarlet Avenue,
Clark Ingram,"ambient, Sleeping, chill, Sleep, calm, Dream, nap"
Ikloó,
Yngwie Malmsteen,"heavy metal, guitar virtuoso, Power metal, metal, guitar, neo-classical metal, swedish, hard rock, instrumental, Guitar Hero"
Duke,"dance, electronic, Power metal, House, Korean, jungle, k-pop, pop, Singeli, funk"
Emmanuel Jal,"Hip-Hop, south sudan, Sudan, world, hip hop, africa, south sudanese, sudanese, african, House"
"Helene Olafsen, Norges Nye Megahit",
"Ezzari, Lamix",
"Caroline Berg Eriksen, Norges Nye Megahit",
"Dripzz, Arab Money, T Section",
Jr Aquino,"covers, american, Filipino, male vocalists, youtube"
McKlopedia,"venezuela, rap, Hip-Hop, rock, Fusion, alternative, alternative rock"
Vàli,"neofolk, dark folk, folk, acoustic, norwegian, instrumental, Norway, melancholic, ambient, atmospheric"
"Kenny Dope, The Bucketheads","House, dance, Hard Dance, hard techno, free download, electronic, trance, acid techno, Dark Techno, funky house"
WILLY DEVILLE ACOUSTIC TRIO,"blues, with a very human soul, a great, singer-songwriter, One of the best, rock, Dead, best songwriter ever, rockpalast, willy deville"
Hedemarkens Sønner,
"Novo Amor, Ed Tullett",
Revolber,"paraguay, Rock Paraguayo, rock, Rock en Espanol, DJHiena, musica en espanol, paraguayan style"
Flou,"paraguay, alternative metal, rock, indie, alternative rock, Rock Paraguayo, french, new metal, electronic, All"
"Cartel De Santa, Patan",
Cesar Franco,"anime, mexico, Dragon Ball, sountrack, digimon"
Johnny Hates Jazz,"80s, pop, new wave, british, soft rock, new romantic, synthpop, male vocalists, Sophisti-Pop, my top songs"
Eruption,"Disco, pop, 80s, 70s, thrash metal, dance, electronic, british, eruption, Rave"
"Circa Waves, PVRIS",
"Solar, Białas","rap, hip hop, poland, Hip-Hop, Warszawa, underground, trap"
Tim McMorris,"indie, underrated, Hip-Hop, singer-songwriter, indie rock, folk, easy listening, dance, hip hop, acoustic"
Orquesta Candela,"cumbia, Peru"
"Sokół, Quebonafide, Pezet, Shuko",
"Sokół, Zespół Dziecięcy Fasolki, Pereł",
"Emdey, Manene",
"Sokół, Sarius, Zeppy Zep",
"Sokół, Steez83, Maciek Janicki",
"Sokół, DJ B",
"Sokół, Szpaku, Bob Air, Raff J.R.",
"Sokół, Duit",
"Sokół, Fred, Sampler Orchestra",
"Sokół, Hodak, Sampler Orchestra",
"Sokół, Sergiusz, 2latefor",
"Sokół, whølelife",
"Sokół, Magiera",
"Nane, Amuly, Credit, Solomon",
Tony Ejremar,Sweden
Sgt. Barry Sadler,"60s, oldies, Patriotic, pop, military, USA, singer-songwriters, male vocalists, american, Soldier"
Blind Faith,"blues rock, classic rock, rock, 60s, blues, british, Psychedelic Rock, blind faith, psychedelic, hard rock"
Alarga,indie pop
Mazhar Ve Fuat,"turkey, turkish, anatolian rock, Psychedelic Rock, anadolu rock, rock, folk rock, duo, turkish rock"
Cantus,"choral, Classical, acappella, a cappella, choir, cantus, vocal, female vocalists, norwegian, christmas"
Alpis,"swedish, rap"
Yammo,
"Joan Manuel Serrat, Pablo Alborán",
Big Time Rush,"pop, male vocalists, pop rock, nickelodeon, boyband, big time rush, teen pop, boy band, dance, Soundtrack"
"Porta, Soma","rap, Hip-Hop, spanish hip-hop, hip hop, comedy, spanish, spain, porta, emo, lol"
Viven,"punk, punk rock, hardcore punk, spanish, galiza, barcelona, Galicia, Vigo hardcore, amfest, hardcore 80s"
Aberola,
"Cosmic Gate, Eric Lumiere",
"Dannii Minogue, Tina Arena",
"RAC, Rostam",
"The Smith Street Band, Tim Rogers, Laura Stevenson",
"SLUMBERJACK, Sydnee Carter",
"Dillon Francis, G-Eazy",
Evidence,"Hip-Hop, underground hip-hop, rap, Dilated Peoples, hip hop, los angeles, underground rap, west coast, West Coast Rap, producer"
Kevin Michael,"rnb, soul, funk, Hip-Hop, american, male vocalists, pop, hip hop, USA, singer-songwriter"
"Andrew Lloyd Webber, ""Cats"" 1981 Original London Cast",
Amen Jr,"rock, indie, gospel, indie rock"
Karra,"singer, pop, romania, EDM, WILD LOVE, Karra"
Kafé,"alternative, brasil, rnb, trap, RNB SOUL, LMC"
"French Montana, Future",
Thomas Newman,"Soundtrack, instrumental, ambient, Classical, chillout, composer, american, score, Thomas Newman, composers"
Haides,
DREAMCAR,"new wave, electronic, pop, rock, new romantic, 80s, synthpop, indie rock, power pop, USA"
"Future Islands, Debbie Harry",
"Wolfgang Gartner, Aero Chord",
John Jorge,
LIV,"Croatia, swedish, lykke li, speed metal, alternative rock, Sweden, indie, Speed Thrash Metal, miike snow, folk rock"
Saul Rivers,
Jóvenes Pordioseros,"All, argentina, argentinian, rocanrol, rolinga"
Fabian Gallardo,"male vocalists, rock, Love, pop, male vocalist, 00s, argentina"
Clark,"idm, electronic, experimental, Warp, electronica, glitch, techno, ambient, british, electro"
"Jokeren, Censur",
Michael Korup,
"Blacks, P Money",
Gotta Go,
"Neverlove, bratishkin",
"SQWOZ BAB, LSP",
"THRILL PILL, Tima Belorusskih",
"Noize MC, Вереница",
"Индаблэк, Skryptonite",
framed,"rock, hard rock, electronic, heavy metal, NWOBHM, alternative rock, modern rock, refreshing, alt. rock, uk rock"
"Gentle Bones, JJ Lin",
John Cafferty,"rock, 80s, classic rock, Soundtrack, rocky, male vocalists, american, Need to Rate, guitar, Narragansett"
Kiko Argüello,"christian, catholic, neokatechumenat, religious catholic neocatechumenalWay christian"
Liisi Koikson,"estonian, jazz, female vocalists, Eesti, estonia, singer-songwriter, vocal jazz, estland, 2013, eurovision backing vocalists"
The O'Jays,"soul, funk, motown, philly soul, rnb, 70s, oldies, rhythm and blues, Disco, american"
Tales Of Evening,"melodic metal, symphonic metal, folk metal, Female fronted metal, epic metal, metal, hungary, Power metal, hungarian, symphonic power metal"
Kask,electronic
"FAM, Bablo",
Tuomari Nurmio,"rock, finnish, singer-songwriter, alternative, blues, suomirock, Suomi, post-punk, experimental, folk"
Ulver,"black metal, experimental, ambient, Avant-Garde, electronic, norwegian, dark ambient, folk, trip-hop, folk metal"
"Aiwa, Mr Tibbz, Admiral General Aladeen",
Del Shannon,"60s, oldies, rock n roll, classic rock, Rock and Roll, rock, american, pop, del shannon, rockabilly"
Falcko,"rap, french, rap francais, french hip-hop, hardcore, Hip-Hop, french rap, nouvelle scene francaise, hip-hop fr, the roots"
Chiara Civello,"jazz, female vocalists, italian, singer-songwriter, vocal, vocal jazz, female jazz contemporary, Smooth Jazz, jazz vocal, female vocalist"
Ultra Vomit,"grindcore, death metal, french, metal, goregrind, humour, parody, comedy, deathgrind, funny grindcore"
"Jan Böhmermann, Olli Schulz",
Nick Brady,
"Neo Noir, Brooke Williams",
Ronin,"post-rock, deep house, folk, italian, breakcore, instrumental, minimal synth, techno, minimal electronic, ambient"
Karuan,"lounge, chillout, ambient, downtempo, Oriental, kurdish, electronic, lounge and chillout, Austria, acid jazz"
CoreTheBand,
"Lifehouse, Natasha Bedingfield",
A Band of Bitches,"rock, latin, mexico, spanish, rock en español, 10s, nortec, Latin Grammy nominee"
Urband 5,"pop, pop trash, Reggaeton Pop"
Kurt Cobain,"Grunge, rock, singer-songwriter, alternative rock, 90s, Nirvana, the best, experimental, punk, USA"
"DaVido, Focalistic",
"Msaki, Abidoza",
"Musa Keys, Dinga, Sino Msolo, Thando Nkosi",
"Jorja Smith, DJ Maphorisa, Kabza De Small",
"Leellamarz, Hannah",
"YEИDRY, J Balvin",
"Brray, Rauw Alejandro",
"Leiva, Elsa y Elmar",
"Dropswitch, Jimmy Wit an H",
"Koji Kondo, Nobuo Uematsu, Tina Guo",
Samual James,"electronic, House, australia, the netherlands, dutch house"
Chris Kilroy,
"Panos Mouzourakis, Pantelis Ampazis",
Robert Palmer,"rock, 80s, classic rock, pop, british, male vocalists, soft rock, robert palmer, pop rock, soul"
"Clement Bazin, LIA",
Oscar Lolang,"bandung, folk, singer-songwriter, acoustic, singer, songwriter, indonesia, cadel, unpad, indonesian"
"Tommie Sunshine, Halfway House",
Bassnectar,"dubstep, electronic, breakbeat, glitch, breaks, experimental, bass, electronica, Hip-Hop, glitch-hop"
"Ragga Twins, Ard",
DWIG,"House, electronic, deep house, german, techno, germany, downtempo, giegling"
Dream The Electric Sleep,"Progressive rock, rock, Symphonic Rock, Progressive, All, USA, Crossover Prog, progressive psychedelic rock, post-prog, Psychedelic Rock"
Mammoth Weed Wizard Bastard,"doom metal, Sludge, stoner metal, sludge metal, psychedelic, Doom, british, UK, welsh, metal"
Cat Power,"indie, female vocalists, singer-songwriter, folk, alternative, indie rock, american, indie folk, indie pop, acoustic"
Ronnie Hussein,
Noah Slee,"soul, electronic, experimental, indie, New Zealand, nz, tongan, future beats, tonga, funk_add_to_lidarr_batch_20"
"Headstrong, Stine Grove",
"Bucket Boys, DJ Maurice",
"831, 柯佳嬿",
Jahn Lengervik,
El Cuero,"norwegian, rock, classic rock, hard rock, Eurovision, Norway, oslo, By:Larm, sett, Kristiansund"
Paula Rojo,"spanish, country, female vocalists, pop, country pop, spain, españa, melendi, lavoz, español"
Seth Ect,"industrial metal, Industrial Death Metal, death metal, industrial, turkish, experimental, turkey, ankara, experimental metal, black metal"
Æ MAK,"irish, indie pop, indie rock, indie, synth pop, crossover, alternative pop, duo, 6 stars, art rock"
"KAYTRANADA, AlunaGeorge, GoldLink",
Hiatus,"Crust, electronic, chillout, crust punk, downtempo, anarcho-punk, ambient, punk, crustcore, electronica"
"Eugenio In Via Di Gioia, Willie Peyote",
"Ex-Otago, Willie Peyote",
"Ex-Otago, Levante",
"Ex-Otago, Dardust",
SHAKALABBITS,"japanese, ska, J-rock, female vocalists, J-Ska, rock, indie, ska punk, JPop, jrock"
Dark new Day,"hard rock, alternative rock, alternative metal, rock, Nu Metal, alternative, post-grunge, metal, Dark New Day, american"
Alaska,"Drum and bass, drumfunk, ska, post-hardcore, hardcore, atmospheric drum and bass, electronic, metalcore, dnb, screamo"
Pierce Fulton,"dance, american, Progressive House, electronic, house music, club, Dirty South, Steve Angello, EDM, Eric Prydz"
Alex Klingle,"electronic, trance, Progressive, progressive trance, EDM, Progressive House"
Cassels,"post-punk, rock, punk, alternative, emo, alternative rock, new wave, teen pop, math rock, punk rock"
"Kura, Melody Noel",
海鳴威,
one sonic society,"Christian worship, contemporary christian, christian, christian rock, powerpop, Pop-Rock, check out later"
Sangre,"Crust, d-beat, black metal, speedcore, hardcore, industrial black metal, blackened speedcore, death metal, breakcore, depressive black metal"
Jukebox The Ghost,"indie pop, indie, piano rock, indie rock, piano, rock, alternative, male vocalists, why wasnt i notified, american"
"Zarelea Figueroa, Joan Sebastian",
"ATB, F51, Robbin & Jonnis",
"La Santa Cecilia, Comisario Pantera",
JT Coldfire,"blues, blues rock, guitar, spotify"
X,"punk, punk rock, 80s, rock, american, japanese, los angeles, female vocalists, California, American Punk"
Wig Wam,"hard rock, glam rock, hair metal, norwegian, rock, Glam Metal, heavy metal, metal, Eurovision, Norway"
"Bebo Valdés, His Havana All Stars",
"Mogsba, Aitor Blond, Aimi",
Rymdfåglar,
Summer Moon,"good, indie, USA, Post punk, post-punk"
Priests,"post-punk, Crank wave, indie rock, art punk, punk rock, no wave, punk, Post punk, riot grrrl, USA"
Bastien Keb,"jazz, Hip-Hop, experimental, psychedelic, indie, hip hop, ambient, Gearbox Records, funk_add_to_lidarr_batch_3, european"
"Wistful, Subsets, Holly Drummond",
"The Orchestra of Syrian Musicians, Damon Albarn, Paul Weller",
Virginia Man,
Jenna Kyle,"pop, indie, USA, electronic, female vocalists"
Shirley Chisholm,
Rothstein,USA
Barack Obama,"scumbag politicians, politician, lemon socialist, zionist, antisemite, political, cult of personality, Hope, blacker than the blackest black times infinity, fuck obama"
Doji,
"Lick Twist, Julius Jones Jr",
Max Sedgley,"chillout, lounge, electronic, british, ambient, trip-hop, downtempo, trip hop, All, nu jazz"
Mystery Jets,"indie, british, indie rock, alternative, britpop, rock, indie pop, alternative rock, london, 00s"
Kurisu,
Nicoline,"Norway, pop, praise and worship, gospel, christian, norwegian, Norge, nederland"
"Snow Boyz, Linni",
"bob hund, Silja Sol",
Rapspillets Obama,
LIMO,"minimal, tech house, minimal techno, electronic"
"Louis Armstrong, Ella Fitzgerald","jazz, swing, blues, jazz vocal, vocal jazz, female vocalists, oldies, ella fitzgerald, louis armstrong, american"
Budgie,"hard rock, classic rock, rock, heavy metal, 70s, british, Progressive rock, blues rock, welsh, metal"
Mariahlynn,"rap, Hip-Hop, female vocalists, hip hop, rnb, East Coast, hiphop, RandB, new jersey, Philly"
"Sixto Rein, Lary Over, Bad Bunny, EZ El Ezeta",
Paula Cole,"female vocalists, singer-songwriter, pop, alternative, rock, american, paula cole, 90s, female vocalist, pop rock"
JayT,"Hip-Hop, piano, Korean"
BP Valenzuela,
"Feist, Jarvis Cocker",
"Kali, Pawbeats","hip hop, rap, polish, chakra, 432 hz"
"Peja/Slums Attack, DVJ Rink",
Moullinex,"electro, nu-disco, electronic, Disco, dance, nu disco, Retro-Electro, Portugal, retro electro, german"
Julius Cowdrey,
Emily Hackett,country
"Tommy Flanagan, Ron Carter, Tony Williams","jazz, instrumental, american"
"Şam, Seda Erciyes",
"Anıl Piyancı, Zen-G, Ouz Baydar",
Erol Evgin,"70s Turkish, turkish, Turkish Pop, pop, 70s turkish pop, nostalji, eskimeyen"
Mavi,"rap, Hip-Hop, jazz rap, hip hop, turkish, abstract hip-hop, Turkish Pop, east coast hip hop, pop, abstract hip hop"
Gnarly Davidson,
Guilherme Guerra,
The Magic Numbers,"indie, indie pop, indie rock, alternative, rock, british, london, britpop, pop, alternative rock"
"Вася Демчук, NK",
"D-Block Europe, Wretch 32",
"D-Block Europe, Jordan Morris, Tiny Boost",
"Tero-Petri, Korvaamattomat",
