artist,genre
"Erik Söderlind, Fredrik Lindborg, Kjell Öhman, Kenji Rabson, Moussa Fadera",
Trevo,"brazil, rap, rnb, portuguese, trap, salvador, brazilian, pagotrap"
"Tritonal, Skyler Stonestreet",
"Eric Prydz, The Cut",
Poetica Musica,
Rising Appalachia,"folk, folk fusion, Fusion, female vocalists, USA, United States, soul, appalachian, gothic country, RandB"
The Hour,"punk, hardcore, australia, australian, future RandB"
If I Were You,"post-hardcore, metalcore, electronic, hardcore, screamo, metal, post hardcore, trancecore, not screamo, electronic hardcore"
"Twisted Insane, Charlie Ray",
Rockabye Baby!,"lullaby, ambient, cover, experimental, children, instrumental, Sleep, lullabies, acalma minhas celulas, electronic"
Talla 2XLC,"trance, electronic, techno, vocal trance, dance, progressive trance, uplifting trance, german, Hard Trance, germany"
Cory Henry,"jazz, funk, nu jazz, piano, gospel, blues, soul, lounge, american, USA"
"Spice 1, Bossolo, Kokane",
"Daz Dillinger, Kurupt, Roscoe",
"Sergi Albert, Samuel Gómez, María Caneda, Daniel Reus, José Alberto Contreras, Adrian Sanz, Elena Cabrero, Dani Garcia, Elenco - La Bella y La Bestia",
"DNMO, KRANE",
"ZOO, Annie Garcés",
Sektion 5,
Trancecore Project,"trance, electronic, artist devotion, Hard Trance"
The Fastback,"rockabilly, Sverige, Teddie Ericsson, rock'n roll, Richard Fransson, Fredrik Hagelberg"
Rivstart,
"Taylor Swift, Kendrick Lamar","garbage, taylor swift, rap, pop, hypnosis, pop rap, hypno, erotic hypnosis, kendrick lamar, kendrick"
Night Works,"electronic, pop, indie pop, funk, france, All, synthpop, Disco, UK, synth pop"
Sly Johnson,"Hip-Hop, soul, funk, Neo-Soul, french soul, beatbox, rnb, Jazz Hop, american, indie soul"
Warpaint,"psychedelic, indie, shoegaze, female vocalists, ethereal, dream pop, indie rock, Psychedelic Rock, alternative, american"
"Wolfgang Amadeus Mozart, Anne-Sophie Mutter, Daniel Müller-Schott, André Previn",
16BL,"House, electronic, dutch, deep house, netherlands, Progressive, techno, deep techno, melodic techno, Progressive House"
Hillsong Chapel,"worship, christian, Hillsong, live worship, australia, acoustic, intimate, southern hemisphere christian music, Cross Rhythms, Hillsong Church"
"Mop Mop, Anthony Joseph, Fred Wesley",
Ethnique Punch,"hip hop, rap, experimental, electronic"
Pilli Bebek,"turkish rock, turkish, rock, hard rock, pilli bebek, ankara, turkey, turkish: rock, drug music, All"
"Uplink, Castion",
"Ah! Kosmos, Aslı Bostancı",
Derdiyoklar,"Psychedelic Rock, psychedelic, turkish, Progressive rock, psychedelic folk, turkish folk, turkish psychedelic, iki kisilik dev orkestra, saykodelik saz, diskofolk"
"Kayliox, CastNowski",
"Etta Bond, Chris Loco",
Pushloop,"USA, dubstep, dark, deep, Dangerous, deep dubstep"
Boom! Bap! Pow!,"rockabilly, rock, blues, indie, pop, australia, indie pop, blues rock"
"Hoosier Scott, Howie Stackz, Monte Booker",
"DPR LIVE, Loco, Jay Park",
Nicotine's Famous Honey,rnb
Octo Octa,"House, deep house, electronic, All, tech house, USA, breakbeat, idm, american, techno"
"Maneva, DEKO",
"Residente, Goran Bregović",
Da Skate,"melodic hardcore, hardcore punk, hardcore melodico, skatepunk, punk, hardcore, political, skate punk, poderoso, punk rock"
San Cisco,"indie pop, indie, australian, indie rock, alternative, pop, power pop, australia, dream pop, rock"
"Joey Bada$$, ScHoolboy Q",
Kyle,"Hip-Hop, rap, rnb, acoustic, pop rap, trap, italian, cosenza, Indie Pop Rap, indie pop"
Girl's Day,"k-pop, Korean, female vocalists, Kpop, pop, girl group, dance, girls day, cute, electropop"
Nick Hill,"electronic, metal, indie, indietronica, Indietronic, Progessive Metal, australia"
Ivy Lab,"trap, instrumental hip hop, Drum and bass, electronic, halftime, deep, future beats, dnb, bass, hip hop"
Atmosphere,"Hip-Hop, underground hip-hop, rap, hip hop, underground hip hop, rhymesayers, Minnesota, underground, alternative hip-hop, underground rap"
"Bob Dylan, Johnny Cash","folk, country, blues, Johnny Cash, americana, Bob Dylan, american, singer-songwriter, folk rock, classic rock"
Mano Le Tough,"House, electronic, tech house, minimal techno, techno, irish, ireland, deep house, All, electronica"
Oliver Koletzki & Fran,"House, electronic, dance, electro, funk, german, female vocalists, hypnotic, deep house, oliver koletzki"
Gungor,"christian, worship, indie, contemporary christian, praise and worship, acoustic, praise & worship, indie rock, post-rock, Alternative Worship"
East Forest,"ambient, psychedelic, electronic, shaman rock, Field Recording, All, chillout, USA, experimental, american"
"Claude Debussy, Natacha Kudritskaya",
"Ludacris, Ty Dolla $ign",
"Fresku, MocroManiac",
"Léa Castel, Soprano",
"Lucio Bukowski, Anton Serra",
"MASNY BEN, mgng",
Al2 El Aldeano,"hip hop, cuba"
"Unos Panas Ahi, The Poggi’s",
Adickta Sinfonía,"hip hop, RAP CHILENO, rap:rap-chileno, rap, Hip-Hop, hip-hop en el camino, hip hop chileno"
Manguala,"reggae, ska, rock nacional"
Jazz Café Bar,"study, jazz, study jazz"
DeepHouseBrothers,
Bola,"idm, ambient, electronic, downtempo, electronica, experimental, Ambient Techno, glitch, chillout, minimal"
"Filipe Ret, BK, Mc Th",
"Bola, Beatriz Capellari",
Meadows,"melodic hardcore, Crust, Sludge, hardcore, post-rock, screamo, ambient, post-hardcore, sludge metal, dream pop"
Moacyr Luz e Samba do Trabalhador,"brazil, brasil, brazilian, mpb, samba"
CPM 22,"hardcore, rock, brazilian, melodic hardcore, brazilian rock, punk rock, brasil, pop rock, pop punk, emo"
Westside Connection,"Gangsta Rap, Hip-Hop, rap, West Coast Rap, hip hop, west coast, underground hip-hop, westside connection, G-funk, Ice Cube"
The Qemists,"Drum and bass, electronic, ninja tune, Drum n Bass, dnb, british, electronica, breakbeat, rock, neurofunk"
Handsome Boy Modeling School,"Hip-Hop, trip-hop, electronic, rap, hip hop, underground hip-hop, prince paul, turntablism, Dan the Automator, alternative"
Oddisee,"Hip-Hop, underground hip-hop, rap, hip hop, instrumental hip-hop, producer, Jazz Hop, underground rap, american, underground hip hop"
"ATB, Andrew Rayel",
The Four Owls,"Hip-Hop, UK hip-hop, underground hip-hop, rap, underground rap, UK, hip hop, high focus, british, 8 stars"
Black Rob,"Hip-Hop, rap, east coast rap, new york, hip hop, East Coast, american, east coast hip-hop, All, Gangsta Rap"
People Under The Stairs,"Hip-Hop, underground hip-hop, rap, hip hop, underground hip hop, Jazz Hop, west coast, los angeles, California, underground rap"
"Geneviève Leclerc, Éric Lapointe",
Taylor Acorn,"pop punk, pop rock, rock, country, pop, singer-songwriter, indie, USA, alternative, Acoustic Rock"
Robotaki,"electronic, Canadian, House, electronica, DIsco House, electro, ambient, canada, bass, chill"
Elenco de Soy Luna,"pop, electropop, Soundtrack, dance, latino, latin pop, Disney, disney channel, better than BTS, Pop Latino"
Crowder,"christian, worship, pop, country, alternative rock, christian rock, dance, pop rock, folktronica, ccm"
La Chicane,"quebecois, canada, francophone, quebec, abitibi"
"Luis Pedraza, Leandro Martinez",
Kenneth Rojas,
Un Rojo Reggae Band,"reggae, costa rica"
"Corey Taylor, Dave Grohl, Rick Nielsen, Scott Reeder","rock, hard rock, post-grunge, alternative, United States, us, gods, 2010s, Incredible, 1Shot"
Pokémon,"Soundtrack, anime, japanese, Pokemon, pokecore, amazing, video game music, 90s, 8-bit, :3"
The Ganjas,"Psychedelic Rock, Stoner Rock, space rock, psychedelic, shoegaze, chile, chilean, dub, rock chileno, rock"
"Granuja, Rapiphero, DJ Dmoe",
"Granuja, Doble Porcion",
Granuja,"Colombia, rap, Hip-Hop, hip hop, boom bap, latin hip-hop, producer, medellin, moebiuz, rap colombiano"
"Granuja, Manas, N. Hardem",
Alpharock,"All, House, electro house, dance, zara larsson, Ariana Grande, EDM"
"Merkules, Geoff English, Blazeon3",
Electric Wire Hustle,"soul, downtempo, Neo-Soul, Hip-Hop, future soul, New Zealand, chillout, funk, psychedelic, hip hop"
"Kyle Olthoff, Courtney Curdy",
PABLO BENDR,
Nakala,"rnb, electronic, female vocalists, UK, british, southampton"
"Teenage Mutants, Laura Welsh",
Gerry Rafferty,"classic rock, singer-songwriter, soft rock, rock, 70s, british, Scottish, gerry rafferty, pop, male vocalists"
Dyango,"spanish, dyango, balada, Love, latin, españa, pop, boleros, spain, boleros mexicanos"
Monkey Black,"hip hop, latino, dembow, Spanish Rock, joa, regueton, Lapiz Conciente, rap dominicano, elcriminal03, vakero"
Alux Nahual,"guatemala, All, latin, rock, experimental, alternative, Neo-prog, Crossover Prog, symphonic progressive"
Cemetery Sun,"rock, alternative rock, my top songs, alternative, Pop-punk, pop, USA, us, Rock im Park 2024"
Deepside Deejays,"dance, club, House, Romanian, electro, electronic, darrell russ, jj arroyo, Baltimore, music"
Monophonics,"funk, soul, afrobeat, psychedelic, nu funk, USA, cool, jazz-funk, California, rnb"
"Pascal Schumacher, Jef Neve",
"Sat Hari Singh, Hari Bhajan Kaur",
"Sasha Almazova, Non Cadenza",
"Kauko Röyhkä, Severi Pyysalo, Maarit Hurmerinta",
"ibe, Kube",
"DJ Snake, Young Thug, Jeremih, Swizz Beatz",
Demon Hunter,"metalcore, metal, christian metal, christian, hardcore, alternative metal, Nu Metal, Christian Metalcore, melodic metalcore, american"
"Scylla, Furax Barbarossa, B-Lel",
"Scylla, B-Lel",
"Sylabil Spill, Hanybal",
"Jerome, Eric Chase",
Claudia Koreck,"singer-songwriter, german, bayrisch, female vocalists, bavarian, pop, bairisch, german girls, deutsch, Bundesvision Song Contest"
"Fallen Roses, B dom",
Humble & Blisse,indie
Triosence,"jazz, piano, contemporary jazz, Smooth Jazz, jazz trio, german, instrumental, jazz piano, asciiecho, bass"
Ashlee Simpson,"pop, pop rock, female vocalists, rock, Ashlee Simpson, american, teen pop, dance, female vocalist, Pop-Rock"
Kutless,"christian rock, christian, rock, alternative, hard rock, alternative rock, worship, post-grunge, Kutless, american"
New Wine,"missian, worship"
Patrick Park,"singer-songwriter, folk, acoustic, indie, indie rock, american, folk rock, male vocalists, Music From the OC, rock"
"Bajofondo, Mala Rodríguez",
Debler,"folk metal, Power metal, spanish, metal, violin, melodic metal, symphonic metal, Spanish Metal, spain, symphonic power metal"
BJ Putnam,
Warren Barfield,"christian rock, christian, acoustic, rock, pop, boring, Mellow, Warren Barfield"
Toto Lopez,
Mc Argueta,hiphop
"Dash Berlin, Matt Simons",
Ratatat,"electronic, instrumental, indie, alternative, electronica, experimental, american, indietronica, indie rock, new york"
Prefekt,"rock, polish, classic rock, polish rock, reggae, hard rock, 80s, dancehall, polskie, polski rock"
Yoste,"electronic, Mellow, australia, chill, slowcore, chilled electronic"
"Yung Lean, Bladee",
Floex,"ambient, electronic, nu-jazz, chillout, Czech, idm, downtempo, electronica, nu jazz, jazz"
Indah Nevertari,
Song Ji Eun,"k-pop, Korean, secret, female vocalists, Kpop, pop, ji eun, song ji eun, ts entertainment, jieun"
Jordan Comolli,"UK, trap, chill trap, electronic superhighway, hybrid trap"
HAHA X MINO,
Sam Amidon,"folk, singer-songwriter, acoustic, americana, indie, american, USA, country, experimental, honkytronica"
"Donae'o, Fred Burguière",
Ben Klock,"techno, minimal, minimal techno, electronic, BPitch Control, Berghain, electro, tech house, german, ostgut ton"
"The Halluci Nation, Yasiin Bey, Narcy, Black Bear",
Tripio X,
"Dargen D'Amico, Isabella Turso, Tedua, Rkomi, Izi",
Rumatera,"italian, rock, rock boaro, punk rock, punk, Italy, veneto, italian rock, R, metal"
Issues,"post-hardcore, metalcore, electronic, experimental, Nu Metal, not screamo, rnb, hardcore, rnbcore, DJENT"
"May J., Keisuke Murakami",
TRF,"j-pop, dance, techno, japanese, JPop, Tetsuya Komuro, 90s, avex, House, Rave"
"Jauz, Marshmello",
"Fakts, GACHO",
"Astor Piazzolla, Artem Chirkov, Ensemble Quintsoul",
"Astor Piazzolla, Ensemble Quintsoul, Artem Chirkov",
xxyyxx,"chillwave, downtempo, electronic, experimental, wonky, future garage, post-dubstep, ambient, electronica, instrumental hip-hop"
AkaHendy,"Canadian, canada, psydub, psybient, chill step, liquid drum and bass, world bass"
Robert Rich,"ambient, dark ambient, experimental, atmospheric, electronic, drone, deep ambient, tribal ambient, american, new age"
Speedometer,"funk, deep funk, modern funk, downtempo, funky, jazz, british, All, nu funk, groove"
Franklyn,"soul, indie, funk, alternative, Grime, rnb, indie rock, r&b, r and b, cdbaby"
Hiba Tawaji,"Lebanon, lebanese, arabic, arabic pop, singer-songwriter, female vocalist, pop, arab, actress, female vocalists"
Yellow Fang,"shoegaze, rock, garage, indie, thai, pop, indie rock, thailand, thai rock, pop rock"
"Mu'adz Dzulkefly, Noh Salleh, Faizal Tahir, Aizat Amdan",
VROMANCE,"k-pop, Korean, Retro, rnb, boy group, pop, Ballad, boybands, ost, RBW"
Bangsoda,
"Platino Records, Andre VII",
Carla Mauri,"pop, rock, dance, latin, female, alternative, pop rock, latin pop, mexico, mexican"
Perfiles,"pop rock, pop, latin pop, 90s, pop trash, teen pop"
"Yurrit, Beau Nox",
GANZ,"ambient, post rock, electronic, alternative, alternative rock, experimental, post-rock, electro, netherlands, post-hardcore"
Lindita,"Eurovision, pop, Albanian, Eurovision 2017, Eurovision Song Contest, ESC, albania, eurovision song contest 2017, ESC 2017, dance"
Victor Démé,"burkina faso, world, african, guitar, africa, African music, blues, burkinabe, mande pop, singer-songwriter"
"Lange Frans, Michael Bryan",
"Lange Frans, Ravenna Moscoso, Thomas Berge",
Almunia,"balearic, nu-disco, psychedelic, dub, electronic, indie, Italy, Psychedelic Rock, guitar, folk"
Pillar,"christian rock, alternative rock, rock, christian, alternative, hard rock, rapcore, Nu Metal, alternative metal, post-grunge"
Sharnar,
Xxxtentacionn,rap
"Moro, Morad",
"Kristen Bell, Santino Fontana","USA, Soundtrack, american, us, United States"
Keith Sweat,"rnb, soul, slow jams, new jack swing, 90s, r&b, keith sweat, male vocalists, quiet storm, male vocalist"
KStewart,"pop, rnb, USA, electronic"
"DJ WTF, DJ Dahler",
"Axel Rudi Pell, Bonnie Tyler",pop
FELA,"afrobeat, jazz, funk, african, world, nigeria, nigerian, 11, World Music, africa"
Tongo,"peruvian, thrash metal, comedy, parody, speed metal, symphonic metal, Comedy Rock, cumbia, Parody Rock, Peru"
Playroom,
"Yellow Claw, Good Times Ahead",
"Dok2, LeeHi",
"E R I K, Tyler & Ryan",
Włodi,"rap, Hip-Hop, Polski Hip Hop, Warszawa, polish hip-hop, polish, All, Molesta, hiphop, hip hop"
"Włodi, Marysia Starosta",
"Donguralesko, The Returners",
"Michael Brun, Lakou Mizik, J Perry",
Charlieblouse and The Milkyboys,singapore
"Regine Velasquez, Jacky Cheung",
"Jatin-Lalit, Udit Narayan, Alka Yagnik",
Jimmy Pé,"beats, abstract hip-hop, abstract hip hop, dubstep, slovak, glitch, beat, Gergazrec, electronic, electronica"
Blank Banshee,"vaporwave, electronic, chillwave, seapunk, trap, vaportrap, newbreed, experimental, Canadian, ambient"
Baby Huey,"funk, soul, rhythm and blues, 70s, blaxploitation, Psychedelic Soul, chicago, green, Chicago Soul, american"
Oum Shatt,"indie, germany, minimalindie, Kissogram, Surf, Berlin, psychedelic, psychodelic, german, arab"
Peter Seller,
Isla Iglú,
Kevin Kline,"rock, country, pop, beatles, america, Patriotic, billy joel, john lennon, Carrie Underwood, elton john"
Danny Prince,
Mitchell Symphony,
Benn Good,
Stefan & Viking,"swedish, dance, electronica"
MojoOnPC,
"Sabina Jarrar, Nemko",
Gissberg,
Sven-Erik Magnusson,
Faraz Azar,
Cody Island,
Marc Dawn,"Hard Trance, trance, electronic, psychedelic, epic trance, psytrance, german, energy trance, Hardtrance"
Stitches,"rap, Hip-Hop, trap, underground hip-hop, hip hop, underground, street punk, USA, Grime, Crunk"
The Strongest Man Who Ever Lived,swedish
Troubled Horse,"Stoner Rock, hard rock, Psychedelic Rock, swedish, rock, retro rock, psychedelic, Southern Rock, doom metal, Garage Rock"
Scars On Broadway,"alternative rock, alternative metal, rock, alternative, metal, Nu Metal, hard rock, american, System of a Down, Scars On Broadway"
Millencolin,"punk rock, skate punk, punk, swedish, rock, pop punk, melodic hardcore, hardcore, Sweden, alternative"
Paper Tiger,"Hip-Hop, electronic, Doomtree, instrumental hip-hop, hip hop, trip-hop, alternative, underground rap, downtempo, Minnesota"
Herbie Hancock,"jazz, funk, Fusion, jazz fusion, piano, jazz-funk, Hard Bop, jazz piano, jazz funk, Post-Bop"
Sparklehorse,"indie, indie rock, singer-songwriter, alternative, rock, Lo-Fi, folk, alternative rock, american, experimental"
"Eva Scolaro, Steen T",
Emmanuel Santarromana,"chillout, lounge, downtempo, easy listening, electronic, trance, electronica, Hotel Costes, dance, french"
Tilia,"indie, ambient, pop, indietronica, switzerland, germany, singer-songwriter, female vocalists, abstract, minimal"
"Blue Lab Beats, Nubya Garcia",
"Tom Misch, Novelist",Lo-Fi Beat
"Moelogo, Tiggs Da Author",
"Kiso, Loé",
Madlib,"Hip-Hop, jazz, funk, rap, hip hop, instrumental hip-hop, underground hip-hop, Stones throw, Jazz Hop, instrumental"
Undercatt,"melodic techno, tech house, techno, House, Progressive House, Italy, italian, Sabrina Carpenter, diynamic, Melodic House"
Caleon Fox,trap
"Flight School, Vega",
The Born Love,
Cameron Bedell,"USA, american"
Jo&Me,
Spencer Roberts,
Degreed,"hard rock, melodic rock, AOR, swedish, rock, melodic hard rock, metal, melodious hard rock, rock-hard"
"Ka5sh, Yung Skrrt",
"Danrell, Alec King",
"Scott Joplin, Benjamin Loeb",
"Antônio Carlos Jobim, Elis Regina",
"Gareth Emery, STANDERWICK, HALIENE",
Maskavo,"reggae, brazilian, brasil, brazil, Maskavo, pop, brazilian rock, male vocalists, Rasta, roots reggae"
"Cedric Gervais, Juanes",
Trast,"rap, polski rap, Masta, polskie podziemie, mst, Katowice"
RJ Malcolm,
Richard Muller,"slovak, pop rock, rock, alternative, pop, slovakia, Czech and Slovak good music, muller, Richard Muller, Europe"
Miracle Of Sound,"rock, video game music, irish, male, metal, pop rock, All, under 2000 listeners, alternative, Progressive metal"
Cartoons,"pop, technobilly, dance, comedy, Brutal Death Metal, danish, denmark, eurodance, Uhh Eeh Uh Ah Ah Ting Tang Walla Walla Bing Bang, bubblegum pop"
"Pain, Kletis, Batrs",
Cemeteries,"dream pop, ambient, indie, shoegaze, ethereal, american, pop, melodic hardcore, hardcore punk, indie rock"
Skywatchers,"experimental, ambient, indie, british, slowcore, LastfmSC, folk, All, downtempo, electronic"
"Gustavo Santaolalla, Diego Luna",
Otis Taylor,"blues, folk, acoustic, singer-songwriter, rock, male vocalists, acoustic blues, Contemporary Blues, american, Otis Taylor"
"Drengene Fra Heden, Charter McCloskey, Lars Therkildsen",
Hubert von Goisern und die Alpinkatzen,"alpenrock, hubert von goisern, austrian, folk, deutsch, german traditional rock, Folk german, Hubert von Gisern und Alpinkatzen, Austria, austropop"
"Bailo, CIISNERO",
Wolfgang Ambros,"austropop, austrian, Austria, german, liedermacher, Mundart, singer-songwriter, deutsch, Wolfgang Ambros, pop"
"Suarez, Alice on the roof",
El Michels Affair,"funk, soul, jazz, afrobeat, instrumental, All, new york, wu-tang, american, hip hop"
Maggie Brown,"indie, guitar, melancholic, indiepop, indierock, guitarmusic, amsterdam"
Carta Na Manga,"hip hop, rap, mogi das cruzes, Rap Nacional"
"Pedro Salomão, Sarah Renata",
NoahStradamus,"Rave, festival, electro house, rage, PLUR, EDM, electronic dance music, NoahStradamus"
Cogumelo Plutão,"pop rock, rock, brasil, post-punk, rock nacional, brazilian, valkyeriex power, pop, classic rock, brazil"
"filous, Bishop",
Bingoboys,"eurodance, Austria, electronic, dance, österreich, elektro-eurodance-dancefloor"
"Lyall Moloney, Phillabusta",
Broken Social Scene,"indie rock, indie, post-rock, Canadian, alternative, experimental, rock, indie pop, alternative rock, ambient"
KIRBY,"soul, rnb, video game music, electronic, tech house, female vocalists, deep house, funk, us, pop"
Florian Bery,"DIsco House, french house, electronic, Disco, nu disco, gliterium"
"After Romeo, Silentó",
Trey Anastasio,"Jam, jam band, rock, singer-songwriter, Jam Bands, phish, funk, alternative rock, american, psychedelic"
"Dhurata Dora, DJ Geek",
Brock Berrigan,"trip-hop, electronic, beat, Hip-Hop, instrumental hip-hop, experimental, beats, USA, instrumental, abstract hip-hop"
Manolo Galvan,"Clasicos AM, manolo galvan, em1"
Ancud,"pop, alternative, chile, alternative rock, Alternativo, rock alternativo, based"
Soul Asylum,"alternative rock, rock, Grunge, alternative, 90s, american, USA, Minnesota, hard rock, Minneapolis"
Christopher Cross,"soft rock, 80s, pop, singer-songwriter, yacht rock, classic rock, american, Christopher Cross, rock, adult contemporary"
"Luz Pinos, Jorge Glem",
Jazz the Roots,"jazz, reggae, ecuador, instrumental, 10s, Contemporary, roots, jazztheroots, jazzy reggae, jazz the roots"
Francesco Napoli,"Disco, Italo Disco, 80s, italian, pop, synthpop, electronic, Italy, Bernardo Montador de Moveis em Recife, Marcelo Nova e A Envergadura Moral"
Wilde Project,
"-M-, Toumani Diabaté, Sidiki Diabaté, Fatoumata Diawara",
"Mike Massy, Chrystelle Nammour, Olivier Blackstone, Gregory Deck",
Heinz Strunk,"comedy, german, electronic, hamburg, pudel artists, spoken word, satire, humor, Hoerbuch, electronica"
Simply Three,"instrumental, classical crossover, cello, contemporary classical, strings, Classical, pop, american, cover, crossover"
Eric Bellinger,"rnb, soul, male vocalists, r&b, pop, urban, Hip-Hop, hip hop, singer-songwriter, rap"
"Billy Ray Cyrus, Bryan Adams, Glenn Hughes",
"SRNO, Naaz",
"Katy Perry, Kanye West","pop, female vocalists, pop rock, indie, rock, american, dance, katy perry, female vocalist, electropop"
Sergei Baronin,"guitar, instrumental, folk, covers, instrumental guitar, acoustic, guitarist, ambient guitar"
"YG, Mustard",
T-Bone Walker,"blues, Texas Blues, Classic Blues, rhythm and blues, delta blues, guitar, t-bone walker, electric blues, american, 40s"
"Danny Darko, Jova Radevska",
St Germain,"acid jazz, chillout, electronic, lounge, jazz, nu jazz, downtempo, french, House, nu-jazz"
The Spits,"Garage Punk, punk, punk rock, Garage Rock, Lo-Fi, american, rock, seattle, All, MonoMaster"
Le Butcherettes,"Garage Rock, riot grrrl, rock, female vocalists, punk, Electroclash, Garage Punk, mexico, punk rock, alternative rock"
Chris Pontius,"punk rock, jackass, crazy, PartyBoy, rock, american, punk, All, California, Punk N Roll"
Sarasvati,"Avant-Garde, singer-songwriter, female vocal, electronic, avant garde, indonesia, ambient, new wave, J-rock, post-punk"
Charles Bradley,"soul, funk, rhythm and blues, daptone, american, blues, rnb, USA, male vocalists, oujeah"
Jacob Tillberg,"electro, Sweden, hardstyle"
"Stefano Lentini, Charlie Winston",
Chabani,"indie, pop, rap, italian, hip rock"
Alex Newell,"pop, House, dance, rnb, american, electronic, garage, glee, Massachusetts, queer"
TRICERATOPS,"rock, J-rock, japanese, j-pop, alternative, pop, power pop, stoner, Sludge, japan"
"Nitin Sawhney, Stealth",
Simone White,"female vocalists, folk, singer-songwriter, indie, indie pop, acoustic, american, pop, indie folk, female vocalist"
Françoise Hardy,"french, female vocalists, 60s, chanson, french pop, ye-ye, pop, chanson francaise, france, singer-songwriter"
Beacon,"electronic, ambient, downtempo, minimal, post-dubstep, chillout, us, USA, electronica, chillwave"
The Gloaming,"celtic, folk, irish, instrumental, celtic folk, world, female vocalists, ireland, neoclassical, progressive folk"
Michael Stearns,"ambient, Space Ambient, new age, deep ambient, atmospheric, electronic, space music, Soundtrack, american, dark ambient"
Modest Intentions,"Drum and bass, liquid funk, Liquid, electronic, dubstep, drum & bass, intelligent drum and bass, liquid dnb"
"MELER, Lérica",
Kinny,"soul, nu-jazz, jazz, electronic, tru thoughts, female vocalists, Canadian, funk, canada, nu jazz"
Tapones de Punta,"soul, funk, rnb, argentina, brass band"
Chava Salazar,
BAYNK,"pop, electronic, All, New Zealand, nu-disco, tropical house, future bass, purple house, funk_add_to_lidarr_batch_3, groove bass"
"José Pablo Moncayo, Alondra de la Parra, Philharmonic Orchestra of the Americas",
Ki:Theory,"indie, electronic, indie rock, alternative, rock, indietronica, alternative rock, virginia, experimental, electropop"
Midas,"heavy metal, Progressive rock, NWOBHM, happy hardcore, hard rock, pop, japanese, symphonic prog, US MEtal, indie"
"D'Angelo, Femi Kuti, Macy Gray, Nile Rodgers, Roy Hargrove, The Soultronics, Positive Force",
Eliane Elias,"jazz, female vocalists, brazilian, piano, jazz piano, Bossa Nova, vocal jazz, Smooth Jazz, jazz vocal, latin jazz"
"Edsilia Rombley, Re-Play",
Sammy Johnson,"All, reggae, australian, New Zealand, funk_add_to_lidarr_batch_23, World Music, maori"
Sussie 4,"electronic, House, acid cabaret, mexico, electronica, lounge, rock, latin, mexican, down tempo"
Five,"pop, boybands, 90s, british, dance, boyband, male vocalists, five, britpop, nostalgia"
"RITUAL, Skizzy Mars",
"Santhosh Narayanan, Vijaynarain",
Los Filipz,
Johnny Yukon,"rnb, pop, rap, hip hop, los angeles, american, Hip-Hop"
Notes Over Storrs,
"Mike Dupree, Maddi Jane",
Pierre Rossouw,
"Chocolate Puma, Pep & Rash",
yirmi7,"turkish, rock"
"Ollane, MiyaGi",
Hualyeogangsan,"Korean, Kpop, girlgroup, Produce 101"
Rilo Kiley,"indie, female vocalists, indie rock, indie pop, alternative, american, rock, pop, folk, female vocalist"
Story Of The Year,"post-hardcore, alternative, rock, emo, screamo, alternative rock, punk rock, emocore, punk, hardcore"
Julie Sue,
"machineheart, Vanic",
"Peter Seller, DJ K.I.P.",
Smart Spain,
"Giovanni Battista Pergolesi, Lucy Crowe, Tim Mead, La Nuova Musica, David Bates",
William Spetz,
"Luciano, Cahiips",
"Antonio Vivaldi, Dmitry Sinkovsky, La Voce Strumentale",
Hot Butter,"electronic, synthpop, 70s, instrumental, pop, moog, electronica, synth pop, USA, one hit wonder"
Tyler Ward,"cover, singer-songwriter, pop, acoustic, youtube, Colorado, rnb, tyler ward, male vocalists, american"
Jawhar,"folk, tunisian, singer-songwriter"
