artist,genre
Antonio José,"Classical, pop, spanish, classical guitar, romantic, All, 20th Century Classical, treble, bachata, LITTLE STAR"
"Aitana, Amaia",
C. Tangana,"rap, Hip-Hop, spanish, rnb, spain, hip hop, latin, pop rap, trap, electronic"
"Juan Magán, B-Case",
"Dasoul, Nacho",
"Pablo Alborán, David Bisbal, Antonio Carmona, Manuel Carrasco, Jesse & Joy, Juanes, Pablo López, Malú, Vanesa Martín, India Martinez, Antonio Orozco, Niña Pastori, Laura Pausini, Abel Pintos, Rozalén, Shakira, Tommy Torres",
"Antonio José, Cali Y El Dandee",
"Natos y Waor, Maka",
Kidd Keo,"trap, spain, latin, rap, alicante, drill, spanish, spanish trap"
Pereza,"spanish, rock, pop, Pop-Rock, Spanish Rock, pop rock, spain, Pereza, rock en español, spanish pop"
Rozalén,"spanish, pop, spain, folk, singer-songwriter, singer-songwriters, latin, bolero, female vocalists, folk pop"
"Amaia, Roi Méndez",
Ana Guerra,"pop, spain, latin pop, spanish, Aguacate, spanish female vocalists, OT, esto es ESPARTA, OT2017"
Maldita Nerea,"spanish, pop, indie, pop rock, indie pop, maldita nerea, rock, spain, spanish pop, latin"
Amaia Montero,"pop, spanish, female vocalists, español, spain, latin, spanish pop, Amaia Montero, singer-songwriter, solista"
"Morat, Alvaro Soler",
Cruz Cafuné,"rnb, rap, spain, spanish, trap, canarias, Espana, Musica Urbana, trap espanol, 2020s"
"Cali Y El Dandee, Shaggy",
Fito y Fitipaldis,"rock, blues, Spanish Rock, blues rock, rock español, spanish, All, rock en español, spotify, spain"
FELIX SANDMAN,"swedish, pop, melodifestivalen, Sweden, dance-pop, overrated, Eurovision, melodifestivalen2018"
Benjamin Ingrosso,"pop, swedish, Eurovision, Sweden, catchy, dance, electronic, Eurovision Song Contest, male vocalists, melodifestivalen"
"Petter, Madi Banja",
Rolandz,"swedish, comedy, Sweden, dancehall, rolandz, svensk, cool, best, svenska, Schlager"
Mariette,"swedish, pop, female vocalists, pop rock, queer, melodifestivalen, Sweden, Eurovision, swedish female vocalists, female"
Margaret,"pop, polish, eurobeat, dance, electropop, female vocalists, electronic, poland, Europop, polska"
John Lundvik,"soul, male vocalists, Eurovision, swedish, Eurovision 2019, melodifestivalen 2019, eurovision song contest 2019, Eurovision Song Contest, melodifestivalen, Sweden"
"Molly Sandén, Leslie Tay",
Z.E,"swedish, hip hop, swedish hip-hop, swedish rap"
Hov1,"swedish, rap, pojkbandshiphop, hip hop, pop, hiphop, Hip-Hop, Sweden, scandinavian, skit"
Jessica Andersson,"swedish, pop, female vocalists, Sweden, melodifestivalen, svenskt, Eurovision, All, scandinavian, nordic"
Olivia Eliasson,"swedish, pop"
Sigrid Bernson,"swedish, Sweden, pop, dance, melodifestivalen 2018"
Moncho,"bolero, spotify, easy listening, swedish, spain, spanish, oldies, All, Reggaeton, male vocalists"
"Hov1, Jireel",
Kaliffa,"swedish, reggae, rap, hip hop, Hip-Hop, dancehall, kaliffa"
"Joakim Lundell, Lazee, Miinou",
Martin Almgren,"rock, swedish, winner, idol, melodifestivalen 2020 wishlist, swedish male vocalists, Idol Sverige, vinnare"
Renaida,"pop, dance, rnb, swedish, swedish female vocalists, melodifestivalen 2020 wishlist, melodifestivalen 2019 wishlist"
"Parham, Mwuana",
Elias Abbas,"rnb, swedish, immigrant"
Dotter,"pop, swedish, female vocalists, Sweden, melodifestivalen, collection, female vocal, 4, deezer, under 1000 listeners"
Rhys,"pop, australian, Hip-Hop, swedish, Aussie Hip-Hop, Broken Tooth Entertainment, electronic, dance, electronica, Sweden"
VAX,"idm, dubstep, experimental, electronic, ambient, AXyETb, House, experimental dubstep, deep house, dance"
Lamix,"hip hop, swedish"
"Z.E, Thrife",
Chris Kläfford,"amazing voice, swedish male vocalists, melodifestivalen 2020 wishlist"
"Z.E, Adel",
"Omar Rudberg, Lamix",
Benislav,"swedish, Sweden"
"Z.E, Cherrie",
"Lamix, Mwuana, Jireel, Blizzy, Elias Abbas",
Darin,"pop, swedish, dance, rnb, male vocalists, idols, Sweden, darin, electronic, sexy"
"Z.E, Dani M",
Kamferdrops,"pop, swedish, melodifestivalen 2019 wishlist, norwegian, melodifestivalen 2023 wishlist"
Adel,"soul, female vocalists, british, singer-songwriter, indie, pop, jazz, Adele, female vocalist, UK"
Edward Blom,swedish
"Oskar Linnros, Jireel, Ana Diaz",
"Ricky Rich, ARAM Mafia",
Ida Redig,"swedish, singer-songwriter, indie, acoustic, Sweden, nordic, pop, female vocalists, Scandinavian Girls, melodifestivalen 2018"
Tjuvjakt,"swedish, Hip-Hop, emo, Grunge, rap, black metal, noise rock"
"Z.E, Denz",
"Z.E, Biggie Juke",
Uno Svenningsson,"swedish, pop, singer-songwriter, svenskt, male vocalists, nordic, rock, Sweden, scandinavian, blandband"
Molly Sandén,"pop, swedish, female vocalists, Sweden, melodifestivalen, scandinavian, Swedish Pop, nordic, Junior Eurovision, All"
"Denz, Z.E",
Emmi Christensson,"swedish, melodifestivalen, melodifestivalen 2019 wishlist, swedish female vocalists, melodifestivalen 2020 wishlist"
Gee Dixon,swedish
John De Sohn,"trance, House, dance, swedish, electronic, pop, electronica, Sweden, progressive trance, All"
"Hot Shade, Christian Walz",
"Joakim Lundell, Sophie Elise",
"Joakim Lundell, Arrhult",
"Dani M, Jireel",
"Meron, Donyanah",
"Calum Scott, Leona Lewis",
LBSB,"swedish, rap, Hip-Hop, svenska"
"ODZ, Azide",
"Ahdam, Parana",
Lo & Leduc,"Hip-Hop, rap, switzerland, swiss, swiss hip-hop, pop, hip hop, Mundart, bern, electronic"
"A-Mei Chang, Eve Ai, LaLa Hsu",
李千那,"C-pop, chinese, taiwanese"
Pei-Yu Hung,"taiwanese, taiwan"
"A-Mei Chang, E-SO",
Wang Jun Qi,China
Jolin Tsai,"C-pop, chinese, taiwan, pop, female vocalists, cpop, taiwanese, Jolin Tsai, mandopop, dance"
"Eric Chou, 許瑋甯",
Yisa Yu,"C-pop, chinese, Yisa Yu, pop, China, Asian, cpop, Asian Pop, best of 2017, Chinese Pop"
Nicholas Teo,"C-pop, chinese, male vocalists, malaysia, cpop, taiwanese, pop, malaysian, M-pop, male vocalist"
"Stefanie Sun, Jerry, Lin Zheng-Zhong",
BoA,"k-pop, j-pop, Korean, pop, japanese, female vocalists, JPop, dance, BoA, Kpop"
Tanya Chua,"pop, chinese, singapore, C-pop, mandarin, Tanya Chua, singer-songwriter, female vocalists, cpop, cool"
Tiger Hu,"chinese, rock, C-pop, cpop, chinese rnb, mandopop"
Fish Leong,"female vocalists, C-pop, malaysia, chinese, pop, malaysian, Asian, cpop, female vocalist, mandarin"
Tia Ray,"chinese, soul, pop, C-pop, ost, Soundtrack, mandopop"
"A-Mei Chang, Jam Hsiao",
Landy Wen,"C-pop, chinese, taiwan, pop, cpop, taiwanese, female vocalists, r&b, dance, Asian"
Penny Tai,"chinese, female vocalists, pop, singer-songwriter, C-pop, malaysia, malaysian, mandarin, cpop, female vocalist"
David Tao,"chinese, C-pop, taiwan, pop, r&b, male vocalists, rnb, taiwanese, Asian, cpop"
Bon Jovi,"rock, hard rock, classic rock, 80s, hair metal, american, bon jovi, Glam Metal, glam rock, 90s"
Nicky Lee,"C-pop, taiwanese, Hip-Hop, pop, los angeles, Korean, rnb, mandopop"
Victor Wong,"chinese, romantic, malaysian"
許慧欣,"C-pop, chinese, mandarin, cpop, taiwan, pop, Asian, evonne hsu, taiwanese, mandopop"
"Luis Fonsi, JJ Lin",
Cyndi Wang,"C-pop, chinese, female vocalists, pop, taiwan, taiwanese, cpop, Asian, female vocalist, mandopop"
EggPlantEgg,"taiwanese, indie rock, hokkien, alt-rock, alternative, taiwan, alternative rock"
Yvonne,"swedish, indie, indie rock, rock, indie pop, Sweden, 90's, 00's, pandapop, pop"
Stefanie Sun,"chinese, pop, singapore, C-pop, female vocalists, mandarin, Asian, female, Singaporean, female vocalist"
Yida Huang,"chinese, rock, Soundtrack, ost, Singaporean, mandarin, taiwan, TW-pop, drama sounds"
VaVa,"rap, chinese, Hip-Hop, pop, C-pop, China, hip hop, trap, japan, Chinese Pop"
The Toys,"60s, girl group, oldies, pop, female vocalists, rnb, thai, thai pop, Girl Groups, soul"
"Max Jenmana, พรปวีณ์ ตันกิจจานนท์",
BNK48,"pop, thai, thai pop, t-pop, 48G, Girl Groups, cover, best of 2017, tpop, thailand"
Wonderframe,"hip hop, thailand"
Bird Thongchai,"thai, male vocalists, thailand, Asian, thai pop, pop, classic, Asian Pop, asian music, Bangkok"
Earth Patravee,"thai, thailand"
"Getsunova, YOUNGOHM",
Atom Chanakan,"pop, thai, thailand, thai pop, t-pop"
MEYOU,"thailand, thai"
"Polycat, พี่เทอด",
The Yers,"thailand, thai, alternative, indie, male vocalists, post-punk, indie rock, Smallroom, Thai Indie, t-pop"
D Gerrard,thailand
Peck Palitchoke,thai
Violette Wautier,"thailand, indie, Soundtrack, pop, thai"
Gliss,"shoegaze, indie, indie rock, alternative rock, alternative, Garage Rock, post-punk, psychedelic, dream pop, noise pop"
Mild,"thai pop, Thai Indie, House, electronic, indie pop, irish, thai rock"
Non Tanon,"ruk, music-box"
Ink Waruntorn,"thai, thailand, t-pop, pop, thai pop"
Marc Tatchapon,thai
PORTRAIT,"heavy metal, screamo, emo, swedish, metal, speed metal, Sweden, real screamo, 90s emo, Traditional Metal"
Boy Peacemaker,"pop, All, thailand, thai, thai music, male vocalists, 00s, thai-pop, 00s pop, t-pop"
Bell Supol,
ETC.,"thai, All, pop, Thai artist, world, hardcore punk, Hip-Hop, Asian Pop, singapore, thailand"
Nann,thai music
Playground,"post-punk, noise rock, punk, noise, pop, alternative, finnish, Gothic Rock, punk rock, melodic punk"
"Somkiat, รุ่งโรจน์ อุปถัมภ์โพธิวัฒน์",
"BANKK CA$H, Endorphine",
Ton Thanasit,thai
"Buddha Bless, เกรียน Peace",
Tattoo Colour,"thai, pop rock, Thai Indie, thai rock, pop, male vocalists, thailand, indie rock, indie, rock"
Clockwork Motionless,
Num KALA,"thailand, thai"
Polycat,"deep and dark, electronic beat, alternative popDeep, find beats, Enlightened, thai, synthpop, lesser known yet streamable artists, Cross Over, thailand"
Jazz Spooknickpapiyongkookkook,"pop, thailand"
Better Weather,"emo, rock, punk, indie, pop, All, post-hardcore, Asian Pop, 00s, indie emo"
MEAN,"post-rock, New Zealand, rock, ambient, instrumental, electropop, electronic, atmospheric, pop, piano"
Max Jenmana,thai
The Parkinson,"punk, punk rock, portuguese, Garage Rock, Garage Punk, Portugal, rock, indie, garage, garage rock revival"
"Fymme Bongkot, Ruj Supharuj, LOWFAT",
Oat Pramote,"pop, indie, thai, rnb, daddy, thailand"
Blue Shade,"All, pop, spotify, thailand"
Lula,"thai, indie, female vocalists, female vocalist, House, trance, sexy, thailand, All, Progressive House"
Stamp,"electronic, french, thailand, trip hop, chillout, experimental, All, Thai Indie, stamp, thai"
Namm Ronnadet,
Whatcharawale,"indie, folk, thai, thailand"
KLEAR,"thai, rock, female vocalists, Asian, alternative, pop rock, post-grunge, Buffalo, All, thai pop"
"Oui, Na Polycat, Stamp",
Season Five,"thai, cold wave, coldwave, thailand, french cold wave"
Wanna One,"k-pop, Korean, Kpop, pop, Produce 101, boyband, boybands, Boy Groups, best of 2017, 2017 debuts"
Telex Telexs,"thai, synthpop, thai pop, pop, electronic, Thai Indie, thailand"
Two Popetorn,"rnb, thai, thailand"
"Earn Piyada, คริส หอวัง; อุ๋ย Buddha Bless",
WINNER,"k-pop, Korean, Kpop, YG, winner, male vocalists, yg family, boyband, Ballad, pop"
Pop Pongkool,"thai, indie, where the bears are, thailand"
UrboyTJ,"hip hop, rnb, thai, thailand, t-pop, thai pop, thai hip hop, Thai trap"
"Olly Murs, Louisa",
Singto Numchok,"surf music, thai, thailand"
Paradox,"thrash metal, speed metal, Drum and bass, drumfunk, german, Power metal, metal, germany, german thrash metal, heavy metal"
"PILLS, The Toys",
SEVENTEEN,"k-pop, Kpop, pop, rock, seventeen, Korean, power pop, alternative, electronic, boy group"
Mabel Matiz,"acoustic, turkish, melancholic, singer-songwriter, turkey, male vocalists, akustik, All, indie, pop"
"No.1, Melek Mosso",
Gazapizm,"rap, hiphop, underground hip hop, Hip-Hop, turkey, Turkish Rap"
"Gazapizm, Cem Adrian",
Ezhel,"hip hop, reggae, rap, Hip-Hop, trap, turkey, turkish, ankara, turkish hip hop, reggae-dub"
"Deeperise, Jabbar",
Burak King,
Yüzyüzeyken Konuşuruz,"acoustic, turkey, turkish, singer-songwriter, rock, kadıköy sound, All, evcil, indie folk, indie"
İdo Tatlıses,"turkish, pop, turkey"
Eypio,"pop-rap, rap, Turkish Rap, turkish, turkcerap, alternatif turkce rap, turkce rap"
Ceza,"rap, Turkish Rap, turkish, Hip-Hop, hip hop, ceza, Istanbul, rapstar, turkce rap, turkey"
"Feride Hilal Akın, Hakan Tunçbilek",
Ersay Üner,"melancholic, singer-songwriter, turkish"
Gökhan Türkmen,"turkish, pop, acoustic, melancholic, Turkish Pop, Azrail, male vocalists, singer-songwriter, indie pop, indie"
"İlyas Yalçıntaş, Aytac Kart",
Tuğba Yurt,"turkish, pop, turkey, female vocalists"
Deniz Tekin,"turkish, female, turkisch, turkey, turkish female vocalists, sofar sounds"
Allame,"rap, Hip-Hop, turkish"
Hadise,"turkish, rnb, pop, Eurovision, belgian, european, urban, female vocalists, Rihanna, katy perry"
"Gazapizm, The Cash Flow",
Manuş Baba,"turkish, melancholic, akustik, turkey, bu adam iyi, turkish alternative"
Ziynet Sali,"turkish, pop, north cyprus, female vocalists, Turkish Pop, melancholic, cypriot, cyprus, northern cyprus, dance"
Musa Eroğlu,"turkish folk, halk muzigi, world, turkish, ethnic, All, turku, baglama, saz, spotify"
"No.1, Heja",
INNA,"dance, House, electronic, trance, Romanian, inna, female vocalists, pop, euro house, electro"
Sena Şener,"turkish, turkey, alternative, rock, woman, soft rock, indie, singer-songwriter, female, alternative rock"
Gripin,"turkish rock, turkish, rock, alternative rock, alternative, gripin, turkey, 77davez-artists, All, piano rock"
Bağzıları,"indie, rock, indie rock, Alternatif, turkey, Slow Down, Turkce"
Soner Sarıkabadayı,"turkish, pop, singer-songwriter, acoustic, turkey, melancholic, male vocalists, Turkish Pop, soner, male vocalist"
Kezzo,
Can Bonomo,"turkish, rock, singer-songwriter, Eurovision, turkish alternative, turkish rock, indie, male vocalists, alternative, alternative rock"
Can Yüce,
Cem Adrian,"alternative, Cem Adrian, turkish, electronic, clinically romantic, post-revolutionary pop song, Avantgarde Pop, genius, All, turkey"
Ayse Hatun Onal,"turkish, House, female vocalists, electronic, turkey, pop, electropop, alternative, dance, turkish electronic"
"Murat Dalkılıç, Oğuzhan Koç",
Xir,
Berksan,"turkish, pop, Turkish Pop, berksan, turkce pop, male vocalists, All, Turk, acoustic, singer-songwriter"
Zakkum,"turkish rock, rock, turkish, alternative rock, zakkum, Turkish modern rock, alternative, world, All, soft rock"
Aylin Coşkun,"turkish, Turkish Pop"
Haluk Levent,"anatolian rock, turkish rock, rock, turkish, anadolu rock, haluk levent, hard rock, anatolian, Turkce, oriental rock"
"Hidra, Şehinşah, FerzanBeats",
Yener Çevik,"bu ne aq, turkey"
Aleyna Tilki,"turkey, turkish, Turkish Pop, pop, teen, Asian, teen pop, 10s, european, Asian Pop"
"Erdem Kınay, Ikizler",
Pamela,"turkish rock, turkish, female vocalists, rock, gospel, pop, pop rock, All, turkey, teen"
Mehmet Güreli,"turkish, jazz, ethno blues, singer-songwriter, All, male vocalists, bard, kent muzigi, etnic, turkish: alternative"
Can Kazaz,"acoustic, indie, turkish"
Yıldız Tilbe,"female vocalists, pop, Turkish Pop, singer-songwriter, arabesk, turkish, melancholic, Halk, beautiful, All"
Levent Yüksel,"turkish, pop, Turkish Pop, world, bass, male vocalists, All, unutulmaz, turkish pop history, melancholic"
"Hayki, Eypio",
Cem Karaca,"turkish, anatolian rock, anadolu rock, turkish rock, rock, psychedelic, Psychedelic Rock, cem karaca, yol, Progressive rock"
Sufle,"turkish, acoustic, female vocalist, easy listening, smooth, soft, cover, turkey"
Melek Mosso,"turkish, turkey, Turkish Pop"
Tarkan,"turkish, pop, Turkish Pop, dance, tarkan, male vocalists, turkey, world, arabic, megastar"
Şebnem Ferah,"turkish rock, rock, female vocalists, turkish, alternative, hard rock, turkey, Sebnem Ferah, alternative rock, singer-songwriter"
Ferdi Özbeğen,"pianist, 80s, turkish, piano, crooner, turkey, Classical, classical turkish music, investigate, baas"
Rengin,"turkish, turkey, 90's"
"Dolu Kadehi Ters Tut, Canozan, Deniz Tekin",
Berkay,"pop, turkish, Turkish Pop, folk, singer-songwriter, ethnic, All, male vocalists, sorchi"
Contra,"breakcore, stoner metal, hardcore, punk, metalcore, noise, chiptune, swedish, Drum and bass, stoner"
Aysel Yakupoğlu,"folk, turkish, karadeniz, Turkish Pop"
Şehinşah,"trap, Turkish Rap, hasan sabbah, Flex, underground, turkey, Hip-Hop, rhyme, kral, Sabbah"
Cengiz Özkan,"turkish, folk, halk muzigi, turku, turkish folk, world, turkey, wood and string, baglama, yol"
Gece Yolcuları,"turkish, turkish rock, alternative rock, soft rock, rock, pop rock, gece yolculari, Turkce, turkey, Abuk Rock"
Gökhan Özen,"turkish, pop, Turkish Pop, male vocalists, dance, turkey, world, tur isf, isf2009, gokhan ozen"
B Young,"british, hip hop, Hip-Hop, english, cypriot, urban, Grime, United Kingdom, 5 Stars, spotify"
Hardy Caprio,"Grime, Hip-Hop, london, hip hop, british, england, rap, english, UK, United Kingdom"
"Dave, MoStack",
J Hus,"Grime, rap, Hip-Hop, UK, Afroswing, england, afrobeats, dancehall, UK hip hop, pop rap"
Kojo Funds,"Hip-Hop, Grime, london, reggae, UK, rap, hip hop, england, britain, UK Grime"
Steel Banglez,"Grime, rnb, Hip-Hop, hip hop, english hip hop, British Hip Hop, british"
MoStack,"rap, Grime, hip hop, Hip-Hop, UK, english, british, dancehall, afrobeat, British Hip Hop"
Yxng Bane,"british, london, Hip-Hop, rap, trap, Grime, chill, Afroswing, Yxng Bane"
GRM Daily,"Grime, hip hop, Hip-Hop, UK Drill, UK, british, rap, drill, British Hip-Hop, 5 Stars"
"Mabel, Kojo Funds",
"Hardy Caprio, One Acen",
Mis-Teeq,"rnb, pop, female vocalists, soul, Hip-Hop, british, dance, r&b, hip hop, UK"
Not3s,"rnb, UK, Drum and bass, Grime, dnb, Hip-Hop, soul, british, male vocalists, UK hip-hop"
Yungen,"Grime, All, jay-z"
Junior Senior,"dance, electronic, pop, danish, electronica, denmark, indie, indie pop, House, funk"
Kevin Lyttle,"dancehall, reggae, soca, rnb, dance, Saint Vincent and the Grenadines, Kevin Lyttle, male vocalists, caribbean, pop"
MIST,"ambient, psychedelic, doom metal, electronic, black metal, space, drone, depressive black metal, Traditional Doom Metal, atmospheric black metal"
The Wombats,"indie, indie rock, british, britpop, rock, alternative, indie pop, alternative rock, liverpool, UK"
SL,"Grime, drill, Hip-Hop, rap, UK hip hop, UK, spotify, UK Drill, british, United Kingdom"
t.A.T.u.,"pop, russian, electronic, female vocalists, dance, rock, pop rock, Russian Pop, Russia, electropop"
Evanescence,"Gothic Rock, rock, female vocalists, alternative, Gothic, alternative rock, Gothic Metal, alternative metal, metal, american"
Fredo,"Grime, rap, trap, Hip-Hop, hip hop, electronic, japanese, UK, downtempo, british"
"Dave, J Hus",
Jet,"rock, alternative rock, alternative, indie, indie rock, australian, Garage Rock, hard rock, 00s, Jet"
Kelis,"rnb, Hip-Hop, pop, female vocalists, soul, dance, electronic, hip hop, american, r&b"
Lotto Boyzz,"rnb, Hip-Hop, UK, 3 stars, spotify"
Ultrabeat,"dance, electronic, trance, happy hardcore, club, british, House, ultrabeat, Rave, electronica"
Electric Six,"rock, alternative, electronic, indie, Disco, alternative rock, indie rock, american, funk, dance"
YoungBoy Never Broke Again,"rap, trap, Hip-Hop, louisiana, Gangsta Rap, hip hop, Baton Rouge, pop rap, american, Southern Hip Hop"
Playboi Carti,"trap, cloud rap, Hip-Hop, rap, rage, hip hop, plugg, opium, Woman beater, atlanta"
"Rae Sremmurd, Swae Lee, Slim Jxmmi","United States, guatemala"
GoldLink,"electronic, rap, Hip-Hop, hip hop, rnb, american, trap, future bounce, soul, hip house"
"Migos, 21 Savage",migos
Brett Young,"country, USA, american, country pop, hairy chest, hunks"
Jon Pardi,"country, contemporary country, american, California, country pop, 4 Stars, male vocalists, modern country, spotify, genre: country"
blackbear,"electronic, pop, hip hop, Hip-Hop, rnb, r&b, american, alternative rnb, rap, powerpop"
Tay-K,"trap, rap, plugg, Hip-Hop, Southern Hip Hop, Gangsta Rap, cloud rap, hip hop, american, hiphop"
"2 Chainz, YG, Offset",
"Playboi Carti, Lil Uzi Vert","Playboi Carti, Hip-Hop, american, Lil Uzi Vert"
6LACK,"rnb, rap, soul, Hip-Hop, alternative rnb, atlanta, hip hop, 6LACK, american, us"
"Drake, Quavo, Travis Scott",
"Trippie Redd, 6ix9ine","swag, rap"
Ab-Soul,"Hip-Hop, rap, underground hip-hop, West Coast Rap, hip hop, black hippy, west coast, California, underground rap, tde"
Devin Dawson,"country, rock, folk, americana, country rock, RnB-soul, rnb, funk_add_to_lidarr_batch_7"
Migrantes,"argentina, cumbia pop"
Once Tiros,"ska, Rock uruguayo, uruguay, rock, rio de la plata, Latin Rock, reggae, Ska-rock, Spanish Rock, Ska Rock"
Los Negroni,"plena, uruguay"
El Cuarteto De Nos,"rock, uruguay, Rock en Espanol, Rock uruguayo, indie, alternative rock, rap rock, alternative, latin, uruguayan"
"Super Yei, Jone Quest",
La Vela Puerca,"ska, uruguay, rock, spanish, Ska Rock, ska punk, Rock uruguayo, latin, uruguayan, La Vela Puerca"
"La Reserva, Chule Von Wernich",
"Sky, Justin Quiles, Ñengo Flow, Farruko",
La Sandonga,"plena, uruguay"
j mena,"pop, argentina, pop latin, whore, better than selena gomez, Trans-pop, trap latino"
Mancha De Rolando,"Rock Argentino, rock, argentina, All, rock nacional, Spanish Rock, Rock Nacional Argentino, Rock en Espanol, pop, latinoamerica"
"Nicky Jam, J Balvin",
"Logic, Marshmello",
"Flight Facilities, NÏKA",
Kylie Minogue,"pop, dance, female vocalists, australian, electronic, Disco, 80s, electropop, 90s, Kylie Minogue"
Men At Work,"80s, new wave, rock, australian, pop, classic rock, reggae, pop rock, australia, men at work"
"Olexesh, Capital Bra",
"Olexesh, Nimo",
"Olexesh, Bonez MC",
"Zappi, Special Academy Kids",
"Olexesh, Ufo361",
"Olexesh, Azad",
"ALMA, Tove Styrke",
"Olexesh, Celo, Abdi, Hanybal",
"DJ Khaled, JAY-Z",
Finn,"Grime, electronic, House, indie, alternative, singer-songwriter, piano, speed garage, Glee Cast, deep house"
"Olexesh, XATAR",
"ALMA, MØ",
"CHVRCHES, Matt Berninger",
"Mc Livinho, Gerex, Maejor",
MC WM,"brazilian, funk, baile funk, brazil, brazilian funk, Funk paulista, Funk Carioca"
"Bruno Martini, Timbaland, Johnny Franco",
"Naiara Azevedo, Ivete Sangalo",
Jefferson Moraes,"brazil, sertanejo, iluminados, Sertanejo Universitario"
Swae Lee,"rap, rnb, hip hop, soul, trap, Hip-Hop, pop, swae lee, us, USA"
Julián Serrano,
"El Villano, J-One, Newyorkeeno",
La Reserva,
Felix Gabriel,
"Daddy Yankee, Natti Natasha",
"Reykon, J Alvarez, Kevin Roldan",
Dread Mar I,"reggae, reggae argentino, roots reggae, reggae latino, latin, argentina, Dread Mar I, argentinian, dub reggae, Reggae Rock"
"Mura Masa, A$AP Rocky",
"Snakehips, MØ",
Tash Sultana,"indie, alternative, australian, lgbt, queer, indie pop, reggae, indie rock, australia, female vocalists"
Stanaj,"pop, american, male vocalists, us, Love this song"
"Dastic, CADE",
Miike Snow,"electronic, electropop, pop, synth, dance, swedish, indie, indie pop, synthpop, alternative"
"SLUMBERJACK, Vera Blue",
Cosmo's Midnight,"future bass, chillwave, neon, nu-disco, chillout, synthpop, australian, electronic, australia, groove bass"
Olivia Holt,"pop, female vocalists, Disney, USA, kickin it, dance, american, actress, female vocalist, shake it up"
Blackstreet,"rnb, Hip-Hop, 90s, soul, rap, r&b, new jack swing, blackstreet, hip hop, male vocalists"
Glass Animals,"electronic, trip-hop, indie, british, dubstep, psychedelic pop, indie pop, downtempo, indie rock, trip hop"
The Temper Trap,"indie, indie rock, australian, alternative, rock, alternative rock, australia, dream pop, male vocalists, pop"
Client Liaison,"synthpop, retro electro, electropop, new wave, Italo Disco, indie pop, Disco, All, synthwave, australian"
Winston Surfshirt,"rnb, Hip-Hop, soul, australian, hip hop, chill, orange, funk_add_to_lidarr_batch_29, holiday vibes"
Bag Raiders,"electronic, australian, dance, electro, funk, House, Disco, synthpop, new rave, electronica"
"Paces, NYNE",
"Grey, Bahari",
Bilderbuch,"indie, austrian, indie rock, rock, Austria, german, All, pop, post-revolutionary pop song, Avantgarde Pop"
Gromee,"polish, electronic, Eurovision, House, Eurovision Song Contest, ESC, poland, eurovision 2018, eurovision song contest 2018, esc 2018"
The Neighbourhood,"indie, indie rock, indie pop, rock, alternative, alternative rock, 10s, american, pop, male vocalists"
"Jimmy P, Diogo Piçarra",
"Nick Jonas, Tove Lo",
Denz,"swedish, rap, Hip-Hop, hiphop, Sweden, scandinavian, hip hop, stockholm, swedish hiphop, swedish hip-hop"
The Freshman,chinese
"CHEN, Punch",
La Oreja de Van Gogh,"spanish, pop, female vocalists, latin, pop espanol, spanish pop, la oreja de van gogh, spain, pop rock, rock"
Estopa,"spanish, Flamenco, pop, rock, Estopa, rumba, latin, pop rock, español, spain"
"C. Tangana, ROSALÍA",
India Martinez,"Flamenco, spanish, female vocalists, spain, españa, world, All, pastora soler, under 2000 listeners"
"Kilian & Jo, Erik Rapp",
MKTO,"pop, alternative, indie, indie pop, american, alternative rock, male vocalists, indie rock, USA, United States"
Elin Bergman,"swedish, All, pop, Sweden"
Otto Knows,"House, dance, swedish, Progressive House, club, electronic, All, Otto Knows, EDM, Sweden"
GBOYSWAG,"C-pop, chinese, ost, China, mandopop, cpop"
Van Ness Wu,"C-pop, chinese, pop, Hip-Hop, rnb, los angeles, taiwan, F4, mandopop, taiwanese"
Naiwen Yang,"taiwan, rock, sydney, chinese, Australian Pub Rock, australian, cpop, taiwanese, China, asia"
Shadya Lan,
"Jul, Ninho",
蔡詩蕓,"pop, chinese, cpop, taiwanese, ballads, dance, female vocalist, female vocalists, C-pop, rnb"
陶晶瑩,"C-pop, female vocalists, taiwanese, taiwan, Asian Pop, asian music, Asian, All, cpop, chinese"
Joi Chua,"singapore, folk, singer, pop, joi chua, songwriter, actress, female pop singer"
Zhang Bichen,"chinese, ost, mandopop, China, zhongguo"
"Erol Evgin, Sıla",
"Harun Kolçak, Tan Taşçı",
Keith Urban,"country, singer-songwriter, Keith Urban, australian, rock, male vocalists, modern country, pop, country pop, country rock"
Panic! At The Disco,"alternative, rock, pop punk, indie, emo, alternative rock, pop rock, indie rock, american, pop"
