artist,genre
"Dzeko & Torres, Delaney Jane",
James TW,"british, pop, english, UK, eurosonic2017"
Jesper Livid,
Carmon,
"Chriz & Heino, Ude Af Kontrol",
Albert Dyrlund,
Whitney Houston,"pop, soul, female vocalists, rnb, 80s, whitney houston, american, 90s, dance, diva"
Ella Eyre,"soul, pop, singer-songwriter, female vocalists, indie, british, rnb, UK, All, Neo-Soul"
GIMS,"french, rap, Hip-Hop, rnb, French Music, pop, hip hop, pop rap, congo, french pop"
Danni,
Tujamo,"House, electronic, tech house, german, germany, EDM, electro house, spotify, techno, dance"
"Stanley Most, Rune RK",
Gabrielle,"pop, soul, female vocalists, british, rnb, norwegian, 90s, Norway, Gabrielle, alternative rock"
Nathan Goshen,"House, dance, Israel"
Haddaway,"dance, eurodance, 90s, pop, electronic, House, trance, Europop, euro house, Disco"
Basshunter,"dance, electronic, techno, trance, swedish, eurodance, Hard Trance, electronica, male vocalists, euro house"
Mohombi,"dance, pop, rnb, dubstep, swedish, mohombi, Sweden, r&b, male vocalists, congo"
"Vigiland, Tham Sway",
"Austin Mahone, Pitbull",
"Taio Cruz, Flo Rida","rnb, pop, Hip-Hop, soul, taio cruz, r&b, dance, male vocalists, british, hip hop"
Djämes Braun,"danish, reggae, dance, pop, All, denmark, dancehall"
Skinz,"dubstep, Grime, breakstep, breakbeat"
"NODE, Gilli",
Mads Langer,"singer-songwriter, indie, danish, alternative, acoustic, male vocalists, british, folk, pop, piano"
"Kongsted, Cisilia",
Ukendt Kunstner,"rap, hiphop, danish, pop, denmark, Jarvis Cocker, hip hop"
Vigiland,"trap, swedish, electronic, dance, pop-dance club, Sweden, House, EDM, vigiland, elektro-edm"
"Brandon Beal, Christopher",
The Pointer Sisters,"Disco, pop, soul, 80s, female vocalists, funk, american, 70s, USA, rnb"
NOAH,"pop, indonesia, eks-peterpan, indonesian, Dark Industrial Techno, industrial hardcore, hard techno, alternative, ambient, Psychedelic Rock"
Guru Josh Project,"House, dance, electronic, electro, electro house, trance, club, Guru Josh Project, australian, techno"
Sam Smith,"soul, pop, british, electronic, dance, male vocalists, singer-songwriter, rnb, england, english"
Alex & Sierra,"pop, acoustic, indie pop, indie, The X Factor, X factor, female vocalists, american, Fifth Harmony, 5H"
Danseorkestret,"danish, denmark, dansk, 80s, Need to Rate, danish 80's music, pop, pop rock, 90s, alternative rock"
Avicii,"House, electronic, dance, Progressive House, electro house, swedish, EDM, Avicii, electronica, dj"
Kongsted,"denmark, pop, electro-pop, danish"
Darude,"trance, electronic, dance, techno, electronica, finnish, House, progressive trance, finland, Hard Trance"
"Will Sparks, Wiley, Elen Levon",
"El Alfa, Bad Bunny",
Bad Bunny,"Reggaeton, trap, latin, puerto rico, trap latino, latin pop, Puerto Rican, pop rap, rap, Latin Rap"
"Arcangel, Bad Bunny",
"Arcangel, Mark B., De La Ghetto, Bad Bunny, Amenazzy",
"Rvssian, Nicky Jam, Farruko, Arcangel, Konshens",
DJ Tetraguy,"dominican republic, Dominican, dominicano, dembow, trap dominicano, rap dominicano"
"Lenny Tavárez, Cosculluela",
DJ Nelson,"Latin Urban, latin, puerto rico, Reggaeton, la cantina buenah ondah, Puerto Rican, boricua, puertorriqueno, el campeon del reggae rap, born in san juan"
Amenazzy,"dominican republic, latin"
"Maluma, Arcangel",
Bulin 47,"Hip-Hop, latin, Reggaeton, world, dominican republic, ilg"
Yiyo Sarante,"salsa, dominican republic, latin, Republica Dominicana, dominican salsa"
Los De La Nazza,"Reggaeton, latin, urban, puerto rico, Puerto Rican, Latin Urban"
"Anuel AA, Ñengo Flow, Sinfonico",
"Mueka, Cosculluela",
Pepe Quintana,"Reggaeton, Latin Urban, puerto rico, latin, trap latino, Hip-Hop, Puerto-Rico"
Rasputin,"rap, noise, hip hop, hardcore, industrial, Hip-Hop, electronic, noise ebm, ebm, Power Rhythmic Noise"
"Anuel AA, Kendo Kaponi",
"Fuego, J Balvin",
"Amenazzy, Don Miguelo",
"Héctor Acosta ""El Torito""","latin, bachata, Dominican, merengue, dominican republic"
"Zacaria Ferreira, Yenddi",
"Revol, Bad Bunny, Bryant Myers",
"Bonny Cepeda, Peter Cruz, Ray Polanco, Benny Sadel, Jochy Hernandez, Sergio Vargas, Jossie Esteban, Alex Bueno, Fernando Villalona, Aramis Camilo, Jerry Legrand, Rubby Pérez, Rasputin, Los Hermanos Rosario, RJ",
Chiquito Team Band,"Dominican, salsa"
Johnny Ventura,"merengue, latin, salsa, dance, caribbean, dominican republic, spanish, chill906, bachata, johnny ventura"
Don Miguelo,"Reggaeton, latin, world, dominican republic, dembow, Kuduro, ruk"
Raquel Arias,
"Quimico Ultra Mega, Black Point",
"Tito ""El Bambino""","Reggaeton, latin, spanish, puerto rico, Puerto Rican, latino, emo, dancehall, latin pop, male"
Bryant Myers,"Reggaeton, trap, puerto rico, latin, duro con la boca, Latin Urban, pandereta, el que pego el tra, el rap e como ma acelerao y el trap e como ma lento ma ocuro, brayansito"
Cabas,"pop, latin, colombian, latin pop, Colombia, Fusion, latino, colombiana, All, alternative"
FOOL,"Grime, electronic, denmark"
"Sanluis, Chino & Nacho",
"Juan Magán, Belinda, Lapiz Conciente",
Villamizar,"Colombia, rock, La Cirugia"
El Vega,"reggae, canarias, rock, latin, All, pop, World Music"
Paulina Rubio,"pop, latin, Paulina Rubio, latin pop, mexican, female vocalists, dance, mexico, singer-songwritter, Rock Pop"
"Juan Magán, Tara Mcdonald, Urband 5",
"Fonseca, Alexis y Fido",
Carlos Baute,"latin, pop, venezuelan, Pop Latino, spanish, male vocalists, Carlos Baute, latin pop, venezuela, Baila latina"
"Kygo, Conrad Sewell",
"Snova, Juan Magán",
"Kygo, Parson James",
"Juan Magán, Paulina Rubio, DCS",
Aniceto Molina,"cumbia, Colombia, latin, All, vallenato, folk, oldies, investigate, colombian, fiesta"
Aniceto Molina Y La Luz Roja De San Marcos,"cumbia, cumbia colombiana"
"Los Ángeles Azules, Jay de la Cueva",
Orquesta Internacional Hermanos Flores,
Los Hermanos Flores,"EL SALVADOR, cumbia, All, world, Los hermanos flores"
NOËP,"pop, indie, estonian, electro, electropop, indie pop, electronic, Eesti, indie electronic pop, Electro Pop"
Arttu Lindeman,"rap, finnish, pop, hip hop, male vocalists, Finnish rap, finland, under 2000 listeners, arttu lindeman"
Mikael Gabriel,"finnish, rap, Hip-Hop, finland, Suomirap, hiphop, seen live more than once, hip hop, whip it, Finnish rap"
"Profeetat, Cheek, Elastinen",
Nikke Ankara,"finnish, rap, Hip-Hop, hiphop, overrated, Suomi, finland"
Haloo Helsinki!,"finnish, rock, female vocalists, punk rock, punk, pop rock, pop, finland, suomirock, finnish rock"
JVG,"finnish, rap, Hip-Hop, finland, Suomirap, All, hip hop, male vocalists, Suomi, oon kayny kattomassa"
TIPPA,"oon kayny kattomassa, finnish, trap"
"JVG, Elias Gould, MGI",
Roope Salminen & Koirat,"finnish, rap, finland, Hip-Hop, cover, seen live more than once, finnish hip-hop, seen live many times"
"Brädi, Illi",
Aste,"finnish, Hip-Hop, rap, Suomirap, hiphop, All, Suomi Hip-hop, pop, hip hop, finland"
Pete Parkkonen,"rock, finnish, idols, Grunge, alternative rock, finland, alternative, Suomi, male vocalists, indie"
Adi L Hasla,"rap, Hip-Hop, finnish, Suomirap, trap rap, male vocalists, oon kayny kattomassa, adi l hasla"
"Evelina, Julma H",
"Ida Paul & Kalle Lindroth, Ida Paul, Kalle Lindroth",
Sound Of Legend,"french, covers, france, EDM"
Skandaali,"rap, Hip-Hop, finnish, suomihoppi, Suomi Hip-hop, Suomirap, hip hop, finnish hip-hop, All, Finnish rap"
Hotelli Vantaa,"rap, pop, dance, Hip-Hop, finland, finnish"
"DEM, PistePiste, Maiki",
Evelina,"finnish, pop, female vocalists, finland, Evelina, trap, female artists, Suomen Turku,  dance,  pop"
"Teflon Brothers, Aku Hirviniemi",
"Teflon Brothers, Ressu Redford, Heavyweight",
"Evelina, Mikael Gabriel",
Petri Nygård,"finnish, rap, hip hop, Hip-Hop, humour, Suomirap, Suomi, male vocalists, huumorimusiikki, paskaa"
"Tungevaag, Raaban, Isac Elliot",
"Vilma Alina, Teflon Brothers",
"Adi L Hasla, Mäkki, Kube",
"Alan Walker, David Whistle",
W&W,"trance, progressive trance, Tech trance, electronic, Hard Trance, House, Tech-Trance, dutch, Progressive House, dance"
Ellinoora,"finnish, pop, female vocalists, soul, finland, Suomi, nordic, ellinoora, singer-songwriter, female"
"BACALL, Malo, Prince Osito",
Kaija Koo,"finnish, pop, female vocalists, iskelma, Suomi, finland, pop rock, country women, Schlager, Kaija Koo"
ILARI,"rap, finnish"
Aleksanteri Hakaniemi,"finland, finnish, under 2000 listeners"
SANNI,"finnish, pop, electronic, female vocalists, singer-songwriter, Suomi, finland, 2010s, SuomiPop, alternative"
Hank Solo,"pop, indie, finnish, alternative"
Lauri Tähkä,"finnish, pop, Suomi, finland, male vocalists, SuomiPop, pop rock, Lauri Tahka, pohjanmaa, folk rock"
Cheek,"finnish, rap, Hip-Hop, Finnish rap, Suomi Hip-hop, Suomi, hiphop, Cheek, suomihoppi, finland"
Robin,"finnish, pop, psychobilly, japanese, male vocalists, finland, Japanese psychobilly, punk, teen pop, electronic"
"VG+, Seksikäs-Suklaa",
Pää-äijät,"finnish, pop, dance, rap, male vocalists, finland, Hip-Hop, party-hop, paa-aijat"
Nelli Matula,"finnish, pop, finland, female vocalists, Suomi, nordic, rnb, SuomiPop, european, finnish pop"
Antti Tuisku,"finnish, pop, dance, male vocalist, idols, male vocalists, finland, Suomi, satanic black metal, SuomiPop"
Kube,"Hip-Hop, finnish, Stoner Rock, rap, stoner, stoner metal, Suomirap, finland, Gangsta Rap, alternative hip-hop"
Raappana,"reggae, finnish, Finnish reggae, fi-reggae, suomireggae, chillout, finland, Suomi, dancehall, oon kayny kattomassa"
Happoradio,"finnish, rock, suomirock, pop, Suomi, alternative, pop rock, finnish rock, finland, alternative rock"
"Teflon Brothers, Mariska",
"Mäkki, Keko Salata",
"Elastinen, Johanna Kurkela",
Lucas,"pop, psytrance, k-pop, hardcore, Kpop, psychedelic trance, finnish, superm, NCT, sm entertainment"
"Elastinen, Sami Hedberg",
Anna Puu,"finnish, female vocalists, pop, indie, alternative, idols, scandinavian, finland, finnish pop, rock"
Chisu,"finnish, pop, female vocalists, electronic, indie, singer-songwriter, indie pop, finland, SuomiPop, alternative"
"MAKJ, Timmy Trumpet, Andrew W.K.",
"Samson, EME",
Tuure Kilpeläinen ja Kaihon Karavaani,"folk, pop, finnish, finland"
Janna,"finnish, soul, female vocalists, funk, pop, jazz, finland, folk, lasse kurki, Basso Music Awards"
Mikko Pohjola,"finland, finnish, male vocalists, pop, Eurovision, acoustic, finnish pop, SuomiPop, Uuden Musiikin Kilpailu, UMK"
Reino Nordin,"finnish, reggae, pop, male vocalists, rhythm and blues, finland, rnb, r&b, Finnish reggae, seen live more than once"
"Nikke Ankara, Ollie",
Mäkki,"finnish, rap, electronic, dance, male vocalists, Hip-Hop, estonian, gay music, estonia, Viro"
DJ Katch,electronic
"Spekti, Tasis","Spekti, Tasis"
Alex Mattson,"electronic, dance, finnish, finland, EDM"
"Tungevaag, Raaban, Charlie Who?",
Töölön Ketterä,"rap, Grime, suomigrime, Hip-Hop, Suomi, finland, finnish, Grime Rap Pop, oon kayny kattomassa, big in 2016"
Vesala,"jazz, free jazz, finnish, drums, ECM, Avant-Garde, experimental, Avant-Garde Jazz, percussion, finland"
KLYMVX,
Mouhous,"rap, finland, Hip-Hop, hip hop, finnish, Suomirap"
Arttu Wiskari,"finnish, pop, singer-songwriter, male vocalists, blues, finland, SuomiPop, rock, scandinavian, arttu wiskari"
Redrama,"Hip-Hop, finnish, rap, hip hop, finland, Finnish rap, Suomi, Redrama, finlandssvensk, good rap"
Heikki Kuula,"Hip-Hop, Suomirap, rap, finnish, yellowmic, Suomi Hip-hop, hip hop, Finnish rap, underground hip-hop, heikki kuula"
Robba,
Kaaris,"Hip-Hop, rap, french rap, french, trap, All, rap francais, Ivory Coast, french trap, hip hop"
Feder,"House, deep house, french, dance, electronic, All, france, techno, funk_add_to_lidarr_batch_9, french house"
Boostee,"french, france, french pop, artistes"
"Naive New Beaters, Izïa",
KeBlack,"french, france, africa, pops, DRC, congo, diaspora, african pops, RDC"
SCH,"industrial, noise, french rap, rap, Hip-Hop, Avant-Garde, electronica, noise rock, Sarajevo, trap"
"Dosseh, Booba",
"Yall, Gabriela Richardson","spain, spanish"
"Gradur, MHD, Alonzo, Nyda",
"Nekfeu, Clara Luciani",
"Nekfeu, Nepal",
"Nekfeu, Crystal Kay",
"Nekfeu, Nemir, 2zer, Mekra, Doums",
Sadek,"All, french, french rap, rap, french hip-hop, hardcore, Hip-Hop, france, underground, Crunk"
Broken Back,"indie, pop, france, dance, male vocalists, electro, 10s, eurosonic2016"
Ninho,"Hip-Hop, french, rap, france, trap, NI, trap music, bolivia"
"Nekfeu, Murkage Dave",
Soprano,"Hip-Hop, rap, rap francais, french, french rap, All, soprano, Marseille, french hip-hop, comorian"
Rim'K,"Hip-Hop, french, french hip-hop, rap, french rap, bof, islamic republic of frankistan, 113, fra, spotify"
"Nekfeu, Framal, Jazzy Bazz",
Alonzo,"french hip-hop, Hip-Hop, french, hip hop, rap, Stoner Rock, All, electro, rap francais, france"
Niska,"french rap, rap, french, hiphop, france, All, Hip-Hop, congo, indonesia, hardcore hip hop"
"Damso, Booba",
Vianney,"french, All, chanson, pop, france, singer-songwriter, francais, francophone, indie, guitar"
"Nekfeu, Alpha Wann",
"Sneazzy, Nekfeu",
Shay,"rap, french, female vocalist, hip hop, female vocalists, rnb, Hip-Hop, urban, belgian, Belgium"
Alicia Keys,"soul, rnb, female vocalists, pop, singer-songwriter, r&b, american, Alicia Keys, piano, Neo-Soul"
"Feder, Emmi",
"Fakear, Rae Morris",
Julian Perretta,"pop, british, indie, singer-songwriter, male vocalist, male vocalists, originally, Julian Perretta, indie pop, anglais"
Indochine,"french, new wave, rock, 80s, alternative, alternative rock, post-punk, indie, synthpop, French rock"
Fally Ipupa,"congo, soukous, DR Congo, africa, Congolese, african, All, fally ipupa, World Music, rumba"
"Kalash Criminel, Kaaris",
Gradur,"rap, Hip-Hop, drill, french rap, trap, french, hip hop, france, bob, All"
Damso,"rap, Hip-Hop, Belgium, Rap FR, congo, french, hip hop, Congolese, Rap Belge, rap francais"
Stromae,"electronic, dance, belgian, french, electronica, pop, House, Hip-Hop, Belgium, electro"
Gilbert Montagné,"french, pop, chanson francaise, 80s, france, chanson, singer-songwriter, beaufcore, francais, artistes"
Daft Punk,"electronic, House, dance, techno, electronica, french, electro, french house, Daft Punk, funk"
Jain,"pop, french, indie pop, female vocalists, france, alternative, post hardcore, reggae, post-hardcore, experimental"
Lou Bega,"pop, mambo, latin, dance, 90s, german, male vocalists, latin pop, germany, jazz"
Lykke Li,"indie pop, female vocalists, swedish, electronic, pop, indie, alternative, dream pop, singer-songwriter, chillout"
"Rihanna, Calvin Harris","pop, rnb, female vocalists, dance, Hip-Hop, Rihanna, r&b, hip hop, american, reggae"
Saint Motel,"indie, indie rock, indie pop, american, los angeles, rock, power pop, hard-pop, pop, USA"
Djadja & Dinaz,"france, french"
"Niro, Ivy",
"Nekfeu, Nemir",
Michel Sardou,"chanson francaise, french, pop, Chanson Française, michel sardou, chanson, france, new age, male vocalists, BUHOLIBRE"
Beyoncé,"rnb, pop, female vocalists, soul, Hip-Hop, beyonce, r&b, american, dance, diva"
MRC,rap francais
Lartiste,"french, rap, All, french rap, rap francais, anglais"
MZ,"rap, MM, Paris 13, LV Hip-Hop, motorrad, muzu makslas, hh-lv, RapFr, hiphop-lv exclusive, hiphop-lv"
MisterWives,"indie, pop, indie pop, alternative, american, new york, USA, female vocalists, 2010s, alternative dance"
"Dosseh, Nekfeu",
"Maroon 5, Christina Aguilera","dance, pop, rock, sexy, maroon 5, american, pop rock, hot, female vocalist, USA"
Claudio Capéo,"french, pop, chanson, france, francais, male vocalists, ska, reggea, accordion, Accordeon"
SIYYU,pop
Black M,"Hip-Hop, french, hip hop, france, rap, merde, All, hip-hop francais, french rap, french hip-hop"
Magic System,"african, french, Ivory Coast, soukous, africain-francais, zouglou, ivorian, world, cote divoire, zouk"
Saian Supa Crew,"Hip-Hop, french, rap, hip hop, hip-hop francais, french hip-hop, france, rap francais, French hip hop, french rap"
"Maxwell, RAF Camora, Bonez MC",
Ali Bumaye,"rap, Hip-Hop, juice sampler, disappointing"
Azet,"german, deutschland, kmn, nash, ZUA, AZET"
Lorenz Büffel,"ballermann, party, deutsch, Partymusik, stimmung, german, germany, GS1425, Glaudia jung, mixed-party-ballermann"
"Bonez MC, Gzuz, Kontra K",
"Maxwell, Bonez MC",
"Bonez MC, RAF Camora, Bausa",
"Bonez MC, Gzuz",
"Gzuz, Bonez MC, Sa4, RAF Camora",
"Hanybal, Nimo",
Eiffel 65,"dance, electronic, eurodance, pop, techno, italian, 90s, Europop, Italy, electronica"
Zuna,"rap, hip hop, electronic, german, dance, Hip-Hop"
"Bonez MC, RAF Camora, Hanybal",
"LX, Maxwell",
AnnenMayKantereit,"german, indie, deutsch, rock, singer-songwriter, indie rock, folk, auf tour, indie pop, germany"
Sido,"rap, Deutschrap, german, hip hop, Hip-Hop, sido, Berlin, german rap, aggro berlin, german hiphop"
Kollegah,"Deutschrap, rap, hip hop, doubletime, german, selfmade records, Hip-Hop, zuhaelterrap, Gangsta Rap, german rap"
Coolio,"rap, Hip-Hop, 90s, hip hop, West Coast Rap, Gangsta Rap, west coast, american, G-funk, gangsta"
Ali As,"german rap, german, Deutschrap, rap, Hip-Hop, German hip hop, hip hop, german hiphop, Hamburgs Finest, deluxe records"
"K.I.Z, Henning May",
Maxwell,"soul, Neo-Soul, rnb, Neo Soul, urban, Maxwell, male vocalists, r&b, funk, smooth"
Banda MS de Sergio Lizárraga,"BANDA, BANDA MUSIC, banda ms, mexico, Banda Sinaloense, Norteno, Musica Mexicana"
Calibre 50,"All, latin, BANDA, mexico, mentalidad enferma, World Music, mexican, regional mexican, corridos, NarcoCorrido"
Dear Jane,"chinese, rock, Hong Kong, All, punk, alternative rock, alternative, pop punk, pop rock, punk rock"
Charmaine Fong,Hong Kong
Supper Moment,"All, Hong Kong, rock, soft rock, indie rock, indie, post rock, Progressive rock, pop rock, hard rock"
JW,"Hong Kong, cantopop, Southern Hip Hop, cpop, C-pop, pop, female vocalist, Hip-Hop, female vocalists, asia"
Jason Chan,"indie, experimental, electronic, minimalist, minimalism, Hong Kong, chinese, Peoples republic of china, The Crucible, Shanghai"
BIGBANG,"k-pop, big bang, Korean, BigBang, norwegian, Kpop, rock, pop, alternative rock, k-pop korean hip hop"
Juno Mak,"Hong Kong, All, dark, pop, cantonese, indie, lounge, electronic, singer-songwriter, chinese"
Phil Lam,
Kwan Gor,"C-pop, cantonese, cantopop, Hong Kong, Kwan Gor"
"AGA, Gin Lee",
"CHANYEOL, Punch",
Pakho Chau,"male vocalists, cantopop"
Stephanie Ho,
Eric Chou,"male vocalists, taiwanese, chinese, C-pop, Asian Pop, taiwan, Asian"
TWICE,"k-pop, Kpop, Korean, pop, girl group, twice, female vocalists, j-pop, dance-pop, bubblegum pop"
Jay Chou,"chinese, C-pop, pop, Jay Chou, taiwan, cpop, taiwanese, male vocalists, rnb, Asian"
Mayday,"indie, hardcore, indie rock, taiwanese, metallic hardcore, metalcore, taiwan, chinese, House, techno"
Joyce Cheng,"Hong Kong, pop, cantopop, Canadian, female vocals, chinese, female vocalists, Asian Pop, C-pop, Asian"
"Jay Chou, A-Mei Chang",
BLACKPINK,"k-pop, Kpop, pop, Korean, blackpink, dance, girl group, female vocalists, YG, Hip-Hop"
JJ Lin,"chinese, C-pop, cpop, taiwan, mandarin, pop, male vocalists, Singaporean, All, jj lin"
Justin Lo,"All, male, cpop, C-pop, mandarin, cantonese, Hong Kong, Canto-Pop, chineseANDcantonese, hk pop"
Kay Tse,"Hong Kong, cantonese, C-pop, female vocalists, chinese, pop, kay tse, All, cantopop, Asian"
"Ruco Chan, Nancy Wu",
Joker Xue,"chinese, mandopop, C-pop, Asian"
JC 陳詠桐,China
AGA,"female vocalists, C-pop, Hong Kong, pop, Asian Pop, Asian, rnb, All, cpop, Chinese female vocalists"
Niro,"All, french, french hip-hop, rap, rap francais, hardcore, Hip-Hop, under 2000 listeners, hip-hop fr, spotify"
陳以桐,
BTS,"k-pop, bts, Kpop, Korean, pop, rap, hip hop, Hip-Hop, rnb, dance"
Eason Chan,"Hong Kong, chinese, pop, cantonese, C-pop, cantopop, male vocalists, Eason Chan, cpop, eason"
Crush,"rnb, heavy metal, Korean, pop, k-rnb, k-pop, dance, best of 2017, best of 2016, krnb"
Gin Lee,"pop, C-pop, malaysia, Hong Kong, malaysian, cantopop, female vocalists, Chinese Pop, Asian, cpop"
Terence Siufay,"pop, C-pop, Hong Kong, cantopop, Macau"
Denise Ho,"Hong Kong, cantonese, chinese, female vocalists, pop, C-pop, cantopop, Asian, singer-songwriter, Hocc"
C AllStar,"All, cantonese, pop, chillout, jazzy, nu jazz, acid jazz, Bossa Nova, cpop, Hong Kong"
TAEYEON,"k-pop, Korean, Kpop, taeyeon, SNSD, pop, why so gorgeous, female vocalists, Ballad, female vocalist"
fun.,"indie pop, indie, alternative, pop, rock, american, indie rock, male vocalists, fun, alternative rock"
Dear John,"folk, japanese, acoustic, punk, singer-songwriter, Mixed, pop, cpop, hardcore punk, amsterdam"
Shiga Lin,"chinese, C-pop, China, female vocalists, cpop, Chine, Asian, Shiga Lin"
Joey Yung,"C-pop, chinese, pop, cpop, Asian, female vocalists, Hong Kong, cantonese, cantopop, female"
"Halott Pénz, Agebeat & Kovary",
"Emmsjé Gauti, Aron Can",
Emmsjé Gauti,"Hip-Hop, icelandic, All, iceland, swagalegur, electronic, rap, nordic, Swagalegt"
Friðrik Dór,"All, pop, iceland, icelandic, club, Hip-Hop, dance, scandinavia, r&b, nordic"
Aron Can,"rap, Hip-Hop, iceland, icelandic, cloud rap, under 2000 listeners, turkish"
XXX Rottweiler hundar,"All, rap, icelandic, Hip-Hop, under 2000 listeners, icelandic hip hop, icelandic rap"
Marshmello,"electronic, dance, EDM, trap, pop, american, future bass, House, Progressive House, rnb"
Anji,"male vocalists, male vocalist, berhentidikamu, indonesian"
"Yellow Claw, Ayden",
Rizky Febian,"pop, singer-songwriter, indonesia, rnb, indonesian, jazz pop, soul pop, bandung, sule"
Hivi!,"pop, jazz, indonesian, indonesia, pop jazz, acoustic, j-pop, female vocals, relaxing, happy"
Tulus,"black metal, Norwegian Black Metal, norwegian, jazz, Norway, indonesian, indonesia, pop, melodic black metal, Avant-Garde Black Metal"
Payung Teduh,"folk, acoustic, All, indonesia, jazz, indie, indonesian, folks, keroncong, indonesian indie"
"Dipha Barus, Kallula",
Raisa,"pop, female vocalists, indonesian, indonesia, jazz, raisa, rnb, All, soul, screamo"
Rich Brian,"rap, Hip-Hop, indonesian, hip hop, trap, pop rap, jakarta, Rich Brian, alternative rnb, 88rising"
Dawin,"Hip-Hop, rap, USA, american, Dawin"
Jaz,"Bay Area, Gangsta Rap, brunei, electronic, Disco, USA, eurobeat, G-funk, indonesian, Jazz Hop"
Ten2Five,"indonesian, pop, female vocalist, indonesia, jazz, melancholic, ten2five, All, easy listening, indonesian band"
MALIQ & D'Essentials,"jazz, indonesian, soul, funk, indonesia, pop, MaliQ, All, indonesiaBand, nu jazz"
Daya,"pop, indie, female vocalists, indie pop, electropop, american, my top songs, queer, great discovery, female vocalist"
"Yura Yunita, Glenn Fredly",
Yellow Claw,"trap, electronic, Hip-Hop, House, electro, dutch, netherlands, hardstyle, dance, moombahton"
Andra And The Backbone,"indonesian, rock, alternative, pop, alternative rock, indonesia, music, All, 00s, and the backbone"
Isyana Sarasvati,"pop, Progressive rock, rnb, Progressive metal, female vocalists, indonesia, symphonic metal, indonesian, jazz, classic"
"Young Lex, gamaliél",
Yura Yunita,"female vocalists, pop, Ballad, indonesian, female vocalist, singer-songwriter, jazz, rnb, Yura"
Sheila On 7,"indonesian, pop, indonesia, rock, indo-pop, alternative, Sheila on 7, alternative rock, pop rock, acoustic"
RAN,"pop, jazz, indonesian, trip-hop, ambient, indonesia, rnb, japanese, isf pre09, rock"
"Porter Robinson, Madeon",
Troye Sivan,"pop, indie pop, indie, male vocalists, alternative, synthpop, electronic, australian, electronica, dream pop"
Ada Band,"indonesian, pop, indonesia, ada band, pop indonesia, All, indo pop, indonesian band, indo song, indonesian song"
Monita Tahalea,"jazz, indonesian, indonesia, pop, trip hop, Indonesian Idol, folk, indie, gospel, acoustic"
The Script,"pop rock, rock, irish, pop, acoustic, indie, alternative, alternative rock, The Script, male vocalists"
"Cash Cash, Sofía Reyes",
"Omar LinX, Marshmello",
Sheryl Sheinafia,"indonesian, indonesia"
"The Chainsmokers, Charlee",
Dewa 19,"indonesian, rock, pop, indonesia, pop rock, Progressive rock, 90's, Ahmad Dani, Psychedelic Rock, surabaya"
Andre Hehanussa,"pop, indonesia, classic, Ambon, All, rnb, r&b, male vocalists, andre hehanusa, indonesia pop"
Abdul & The Coffee Theory,"jazz, indonesia, soul, vocal, indonesian, nu jazz, indie, alternative pop, All, pop jazz"
Adam Levine,"pop, male vocalists, maroon 5, pop rock, adam levine, guys i would sleep with, rock, american, alternative, guys I would fuck"
"Anna Kendrick, Justin Timberlake",
Far East Movement,"Hip-Hop, electronic, electro hop, rap, hip hop, dance, pop, electro, american, male vocalists"
Firebeatz,"electro house, electronic, dutch, House, dubstep, electro, dance, djset, fidget house, bass house"
Float,"folk, indie pop, synthpop, progressive psytrance, psytrance, indie, indonesian, indonesia, Home collection, blues"
Sam Kim,"Korean, Ballad, folk, rnb, k-pop, ost, singer-songwriter, Antenna Music, sam kim, k-pop star"
Chrisye,"pop, indonesian, Ballad, rock, indonesia, male vocalists, legend, 70's, Progressive rock, pop rock"
"Yellow Claw, Mustard",
Peterpan,"indonesian, pop, rock, indonesia, pop rock, alternative, alternative rock, PETERPAN, bandung, legend"
D'Cinnamons,"acoustic, indonesian, easy listening, female vocalists, female vocalist, folk, alternative, female guitar player, EPIC WIN, underrated"
GAC (Gamaliél Audrey Cantika),"pop, indonesian, pop Indo, indonesia"
Louisa,"pop, X factor, soul, dance, female vocalists, british, UK, Louisa Johnson, england, X-Factor"
John Gibbons,"electronic, House, cover, irish, male vocalists"
"Jax Jones, RAYE",
Tom Zanetti,"dance, House, rap, electronic, UK, british, party, All, United Kingdom, 4 Stars"
Picture This,"rock, pop, ireland, irish, male vocalists, alternative, USA, pop rock, rock-pop, 10s"
Christine and the Queens,"french, pop, electronic, female vocalists, indie, electropop, synthpop, indie pop, art pop, france"
"Little Mix, Charlie Puth",
Tinie Tempah,"Grime, Hip-Hop, rap, british, dubstep, hip hop, electronic, UK, male vocalists, garage"
Walking On Cars,"indie rock, rock, indie, piano rock, ireland, piano, irish, pop, alternative, pop rock"
