artist,genre
Shakira,"pop, latin, female vocalists, spanish, rock, dance, Shakira, Colombia, sexy, singer-songwriter"
Ricky Martin,"pop, latin, latin pop, dance, spanish, male vocalists, puerto rico, Puerto Rican, Ricky Martin, 90s"
CNCO,"pop, latin, Reggaeton, latin pop, boybands, male vocalists, latino, teen pop, teen, boy band"
"J Balvin, Pharrell Williams, BIA, Sky",
Daddy Yankee,"Reggaeton, latin, Hip-Hop, spanish, rap, puerto rico, Daddy Yankee, hip hop, Puerto Rican, male vocalists"
Sebastian Yatra,"Colombia, Paulina Rubio, Reggaeton, pop, All, latin, latin pop, Popgueton, Urbano Latino, Sebastián Yatra"
Rombai,"All, uruguay, cumbia, cumbia pop, band, party, latin, summer, group, latin pop"
Zion & Lennox,"Reggaeton, latin, puerto rico, spanish, en espanol, zion and Lennox, metalcore, latino, world, aventura"
"Carlos Vives, Shakira",
Ozuna,"Reggaeton, latin, puerto rico, Puerto Rican, Urbano Latino, Latin Urban, male vocalists, trap latino, reggae, caribbean"
"Chino & Nacho, Daddy Yankee",
Thalia,"pop, latin, female vocalists, spanish, latin pop, mexican, mexico, dance, thalia, sexy"
Maluma,"Reggaeton, latin, pop, Colombia, sexy, latin pop, hot, colombian, male vocalists, Brutal Death Metal"
"Charly Black, Daddy Yankee",
Piso 21,"latin, Reggaeton, All, pop, spanish, Colombia, Brutal Death Metal, shit music, boybands, boy band"
Enrique Iglesias,"pop, latin, spanish, dance, latin pop, male vocalists, Enrique Iglesias, romantic, rnb, sexy"
"DJ Snake, Justin Bieber",
Mano Arriba,"cumbia, latin jazz, harsh noise, uruguay, cumbia pop, cumbia-pop"
Wisin,"Reggaeton, latin, dance, puerto rico, pop, latin pop, Puerto Rican, All, Hip-Hop, black metal"
Clean Bandit,"electronic, indie, experimental, british, electronica, pop, House, instrumental, indie pop, uk funky"
Chano,"pop, pop rock, cocaine, latin pop, Argentine Rock, argentina, mecha, chocar, Tan bionica, drug addict"
"IAmChino, El Chacal",
"Drake, WizKid, Kyla",
Calvin Harris,"electronic, dance, electro, Disco, electronica, british, House, Scottish, pop, electropop"
Major Lazer,"electronic, dancehall, reggae, dub, electro, dance, ragga, moombahton, american, trap"
Gente De Zona,"Reggaeton, cubaton, cuba, cuban, All, la habana, world, cubano, merengue, latino"
"The Weeknd, Daft Punk","mistagged artist, Daft Punk, The Weeknd"
Cosculluela,"Reggaeton, cosculluela, Hip-Hop, puerto rico, Latin Rap, latin, rap, jowel y randy, Puerto Rican, flaitecore"
"Maroon 5, Kendrick Lamar",
Bruno Mars,"pop, rnb, male vocalists, r&b, slow jams, soul, Bruno Mars, american, singer-songwriter, reggae"
Justin Timberlake,"pop, rnb, dance, male vocalists, Hip-Hop, american, r&b, Justin Timberlake, soul, hip hop"
Juanes,"latin, pop, spanish, rock, latino, colombian, Colombia, latin pop, Juanes, male vocalists"
J Balvin,"Reggaeton, pop, colombian, latin, Colombia, latin pop, All, hot, dancehall, trap"
"Martin Garrix, Bebe Rexha",netherlands
Los Bonnitos,"All, argentina, cumbia, BANDA, grupo, cumbia pop"
Mike Posner,"Hip-Hop, rnb, pop, rap, electro hop, electronic, r&b, hip hop, electropop, american"
Reik,"pop, latin pop, latin, spanish, reik, mexican, mexico, male vocalists, Romantica, Pop Latino"
"Don Omar, Zion & Lennox","Reggaeton, latin, Hip-Hop, spanish, latino, don omar, puerto rico, hip hop, Puerto Rican, dance"
Joey Montana,"Reggaeton, latin, reggae, Panama, All, espagnol, spanish, Joey, plena, lo mejor"
"Rihanna, Drake","pop, rnb, female vocalists, dance, Hip-Hop, Rihanna, r&b, hip hop, american, reggae"
"Marama, Rombai",
The Chainsmokers,"electronic, pop, House, electro house, dance, american, EDM, dj, electropop, alternative dance"
Nicky Jam,"Reggaeton, latin, pop, nicky jam, oldies, puerto rico, Rock and Roll, All, mierda, raggaeton"
Agapornis,"argentina, cumbia, argentine, the most frostbitten and grim music from the very very very very very very inverted mountains of Kxziiiimfghhhblaghl, cumbia pop, y esto es agapornis, meli lezcano"
DNCE,"pop, pop rock, dance, funk, american, joe jonas, dnce, rock, dance rock, USA"
Farruko,"Reggaeton, latin, Puerto Rican, puerto rico, autotune, Officially Shit, reggaeton-boriqua, trap latino, farruko, Urbano Latino"
Marama,"uruguay, cumbia, cumbia pop, pop, Nena, latin music, tropical, uruguayo, joda, boliche"
"The Chainsmokers, Halsey",
Shawn Mendes,"pop, Canadian, folk, male vocalists, acoustic, singer-songwriter, canada, no talent, sexy, shawn mendes"
El Polaco,"Brutal Death Metal, spanish, polski, cumbia, POLAK, polska, Cumbia villera, spain, shoegaze, grindcore"
"Sebastian Yatra, Cosculluela, Cali Y El Dandee",
#TocoParaVos,"uruguay, cumbia, cumbia cheta, Cumbia uruguaya"
"Pijama Party, Cande Buasso",
Starley,"australian, dance, House, pop, electronic, queer, australia, Mauritius, dance-pop, female vocalists"
"Nicky Jam, Enrique Iglesias",
LOAN,"Sludge, Stoner Rock, psychedelic, stoner, stoner metal, metal, Doom, doom metal, sludge metal, Post-Metal"
"David Guetta, Cedric Gervais, Chris Willis",
"Juan Magán, Luciana",
Rafaga,
"Ozuna, Cosculluela, Revol",
"Steve Aoki, Louis Tomlinson",
"Ariana Grande, Nicki Minaj","Ariana Grande, american"
"Xantos, Dynell",
Sia,"female vocalists, indie, chillout, trip-hop, downtempo, pop, australian, singer-songwriter, alternative, electronic"
"CantoParaBailar, Lucas Sugo",
Fifth Harmony,"pop, female vocalists, X factor, american, rnb, Fifth Harmony, Girl Groups, one direction, girl group, dance"
Charlie Puth,"pop, rnb, soul, american, USA, male vocalists, singer-songwriter, r&b, Singer/Songwriter, Jung Kook"
"Ozuna, Bad Bunny, Farruko, Ñengo Flow",
Abel Pintos,"argentina, folklore argentino, folk rock, latin, folk, singer-songwriter, 00s, indie argentino, Cantautores, folklore"
Jacob Forever,"Reggaeton, cuba, latin, world, cubaton"
"Carlos Baute, Alexis y Fido",
Papichamp,"argentina, cumbia, Cumbia villera, rkt, Cumbia turra, Turreo"
Kevin Roldan,"Reggaeton, All, Colombia, latin, urbano, Perreo, latino, Urban Latino, colombian mafe y gabo"
"Mambo Kingz, DJ Luian, Luigi 21 Plus, Ozuna",
Los Totora,"All, argentina, argentinian, argentino, argentinos"
"aLee DJ, Zeta Music",
"Enrique Iglesias, Descemer Bueno, Gente De Zona",
Sofía Reyes,"pop, Reggaeton, latin, mexico, latin pop, trap, 3, my top songs, deezer, trap latino"
Klasico,
"Cali Y El Dandee, Juan Magán, Sebastian Yatra",
Gilda,"cumbia, latin, argentina, spanish, tropical, female vocalists, 90s, pop, español, argentinian"
"Yandel, Egbert Rosa aka Haze",
Twenty One Pilots,"electronic, alternative, rap, indie pop, indie, alternative rock, pop, Hip-Hop, american, indie rock"
Miranda!,"pop, electropop, argentina, electronic, dance, synthpop, latin, argentinian, glam, alternative"
Justin Bieber,"pop, black metal, rnb, justin bieber, Hip-Hop, r&b, Canadian, male vocalists, female vocalists, Brutal Death Metal"
"Maná, Nicky Jam",
"Chino & Nacho, Daddy Yankee, Don Omar, Wisin",
Kungs,"House, french, dance, electronic, france, deep house, tropical house, tropical, EDM, artistes"
Amar Azul,"Cumbia villera, cumbia, bailanta, grupo la noche, argentinia, argentina, chile, sonidero, amar azul"
"Danny Paz, El Villano",
El Pepo,"Cumbia villera, argentina"
Plan B,"Hip-Hop, british, Grime, rap, hip hop, soul, Reggaeton, pop, UK, UK hip-hop"
"Sak Noel & Salvi, Sean Paul",
Anuel AA,"Reggaeton, trap, rap, latin, Hip-Hop, Latin Trap, puerto rico, trap latino, bellakeo, Latin Urban"
Rodrigo,"Cuarteto, classical guitar, Classical, guitar, argentina, rodrigo, spanish, latin, cumbia, instrumental"
"Pitbull, Sensato, Osmani Garcia ""La Voz""",
"Nevada, Mark Morrison, Fetty Wap",
Banda XXI,"español, argentina, Cuarteto, cordoba, Rio Cuarto"
Reykon,"Reggaeton, latin, Brutal Death Metal, spanish, shit music, All, Colombia, Officially Shit, crimes against humanity, colombian"
Coldplay,"rock, alternative, britpop, alternative rock, indie, british, pop, Coldplay, indie rock, pop rock"
De La Ghetto,"Reggaeton, latin, hip hop, Reggaeton  top-50, De La Ghetto, puerto rico, Hip-Hop, r&b, rnb, male vocalists"
Justin Quiles,"Reggaeton, latin, puerto rico, male vocalists, 10s, Latin Urban, Puerto Rican, USA, dance, sex"
Los Palmeras,"cumbia, argentina, tropical, cumbia argentina, latin, world, World Music, latinoamerican music, cumbia de argentina, latina"
"KAROL G, Ozuna",
Marka Akme,"uruguay, cumbia, jamendo"
Antonio Rios,"cumbia, guitar, shoegaze, latin, Technical Death Metal, argentina"
Grupo Sombras,"latin, cumbia, Cumbia villera, spanish, argentina, latin pop, daniel agostini"
El Villano,"argentina, cumbia argentina, cumbia pop, Cumbia villera, Cumbia turra, cumbia cheta"
"J Balvin, Daddy Yankee",
"Alkilados, Nicky Jam, J Alvarez, El Roockie",
Tambó Tambó,"argentina, cumbia"
La Beriso,"Argentine Rock, argentina, avellaneda, una poronga, Una poronga m, argentine hard rock, crotofroto"
El Reja,uruguay
"Justin Quiles, Yandel, Gadiel",
Los Charros,"cumbia, tropical, Cumbias"
Maxi Trusso,"electronic, electropop, argentina, electronic rock, dance-pop, electro house, male vocalists, washed up, old, new rave"
"Feid, J Balvin",
"Agapornis, Come & C",
Corta La Bocha,
"De La Ghetto, Mambo Kingz, DJ Luian",
Soda Stereo,"Rock Argentino, rock, Rock en Espanol, argentina, 80s, new wave, alternative rock, rock en español, shoegaze, soda stereo"
RC BAND,cumbia
"Alejandro Sanz, Marc Anthony",
"Pitbull, Ne-Yo",
Charly Black,"dancehall, reggae, jamaica, spotify, Dancehall-, american, All, wata vybz radio, knocklife ent, Charly black"
"Jonas Blue, JP Cooper",
Lali,"argentina, pop, dance, latin, spanish, argentine, latin pop, lali, industrial dance, A bailar"
Jambao,"All, argentina, cumbia, argentinian, Cumbia villera"
Juan Magán,"latin pop, latin, electro latino, pop, dance, electronic, House, dj, spanish, spain"
Benjamín Amadeo,"pop, latin, argentina"
Maroon 5,"pop rock, rock, pop, alternative, alternative rock, american, male vocalists, maroon 5, funk, indie"
"ZAYN, Taylor Swift","garbage, hino, epic, pop, fav, hypnosis, hypno, erotic hypnosis, ns pop, femboy"
James Arthur,"pop, british, indie, acoustic, X factor, male vocalists, alternative, singer-songwriter, english, rock"
"NEIKED, Dyo",
Peking Duk,"indie, House, dance, electronic, australia, australian, funk, electronica, pop, Hip-Hop"
"Rae Sremmurd, Gucci Mane",
Andy Grammer,"pop, singer-songwriter, acoustic, Mellow, american, los angeles, All, male vocalists, genre: singer-songwriter, male vocalist"
Mura Masa,"electronic, future bass, lovestep, chill trap, trap, downtempo, british, electronica, instrumental, indie pop"
Zara Larsson,"pop, swedish, female vocalists, indie, Sweden, soul, my top songs, indie pop, electronic, dance"
Alessia Cara,"pop, soul, rnb, Canadian, female vocalists, singer-songwriter, indie pop, canada, alessia cara, my top songs"
Drake,"Hip-Hop, rap, rnb, hip hop, Canadian, Drake, pop, r&b, canada, young money"
"FRENSHIP, Emily Warren",
"The Chainsmokers, Phoebe Ryan",
"Hailee Steinfeld, Grey, Zedd",
"The Vamps, Matoma",
"Jonas Blue, RAYE",
Flume,"electronic, chillout, wonky, australian, instrumental hip-hop, downtempo, future bass, hip hop, glitch pop, trap"
Illy,"australian, Hip-Hop, hip hop, Aussie Hip-Hop, mpb, Aussie, underground hip-hop, brazil, Aussie hip hop, Bahia"
Milky Chance,"indie, indie rock, reggae, german, singer-songwriter, blues, pop, electronic, folk, indie folk"
Sage The Gemini,"Hip-Hop, rap, hip hop, american, Bay Area, California, my top songs, male vocalists, USA, West Coast Rap"
"Robin Schulz, David Guetta, Cheat Codes",
Mike Perry,"swedish, electronic, tropical house, dance, electronica, House, Sweden, eletronic, club, Progressive"
"The Chainsmokers, XYLØ",
Cashmere Cat,"electronic, chillwave, trap, Hip-Hop, wonky, norwegian, All, future bass, instrumental hip-hop, Norway"
"Galantis, Hook N Sling",
"Flume, kai",
PNAU,"electronic, australian, dance, electro, electronica, House, synthpop, indie, new rave, electropop"
Calum Scott,"pop, british, acoustic, hairy chest, queer, english, cover, male vocalists, england, Ballad"
Childish Gambino,"Hip-Hop, rap, hip hop, indie, underground hip-hop, american, funk, rnb, soul, alternative hip-hop"
Machine Gun Kelly,"Hip-Hop, rap, pop punk, Cleveland, hip hop, MGK, machine gun kelly, rock, american, punk"
"Zay Hilfigerrr, Zayion McCall",
John Legend,"soul, rnb, Neo-Soul, singer-songwriter, Hip-Hop, r&b, male vocalists, John Legend, american, Neo Soul"
"Noah Cyrus, Labrinth",
Charli XCX,"pop, synthpop, electronic, female vocalists, Electroclash, electropop, hyperpop, british, bubblegum bass, pc music"
MØ,"indie pop, danish, dream pop, pop, indie, female vocalists, electronic, fav888, chillout, Skitz0rz"
Migos,"Hip-Hop, trap, rap, trap rap, hip hop, atlanta, american, southern hip-hop, Southern Hip Hop, Dirty South"
Shelley FKA DRAM,"rnb, rap, trap, soul, Hip-Hop, hip hop, experimental, United States, american, underground hip hop"
The Weeknd,"rnb, electronic, dubstep, Canadian, prog-rnb, pop, r&b, alternative rnb, soul, Hip-Hop"
MiC LOWRY,"pop, rnb, aachen, deutsch, JFK666s favorite artists"
Little Mix,"pop, british, female vocalists, Girl Groups, X factor, dance, Hard Dance, trap, Nightcore, footwork"
Joel Adams,"australian, pop, singer-songwriter, australia, eurovision 2020 wishlist, blue eyes, soul, australia decides 2021 wishlist"
The xx,"indie, electronic, post-punk, british, dance, alternative, dream pop, indie pop, indie rock, shoegaze"
Sofi Tukker,"dance, electronic, pop, indie, new york, american, electropop, electronica, House, portuguese"
"Drake, Rihanna","pop, rnb, female vocalists, dance, Hip-Hop, Rihanna, r&b, hip hop, american, reggae"
Rag'n'Bone Man,"soul, blues, british, indie, Hip-Hop, UK, english, male vocalists, pop, alternative"
"PON CHO, Paige IV",
Adele,"soul, female vocalists, british, singer-songwriter, indie, pop, jazz, Adele, female vocalist, UK"
"Hilltop Hoods, Montaigne, Tom Thum",
J. Cole,"Hip-Hop, rap, hip hop, North Carolina, underground hip-hop, Jazz Hop, j cole, american, Conscious Hip Hop, underground rap"
Desiigner,"Hip-Hop, rap, trap, hip hop, american, Brooklyn, good music, future, hardcore rap, Desiigner"
The Veronicas,"pop, pop rock, female vocalists, australian, rock, electropop, electronic, the veronicas, dance, pop punk"
Amy Shark,"pop, indie pop, australian, female vocalists, singer-songwriter, synthpop, singer-songwriters, australia, electro, synth pop"
Aminé,"rap, Hip-Hop, trap, hip hop, american, portland, pop, hip house, USA, pop rap"
"Jonas Blue, Dakota",
Lukas Graham,"pop, soul, danish, retro pop, denmark, trollerier, funk, Blue-Eyed Soul, danish pop, All"
gnash,"pop, rock, Grunge, american, Grunge Rock, Gnash, indie pop, alt-RnB, black metal, pearl jam"
Ariana Grande,"pop, rnb, female vocalists, Ariana Grande, american, dance, r&b, nickelodeon, soul, dance-pop"
Alan Walker,"electronic, House, EDM, dance, norwegian, electro house, electronica, festival progressive house, electropop, british"
Lil Wayne,"Hip-Hop, rap, Dirty South, hip hop, southern rap, Lil Wayne, american, Gangsta Rap, New Orleans, young money"
Tove Lo,"pop, swedish, electronic, female vocalists, indie, electropop, indie pop, synthpop, Sweden, dance-pop"
"Dante Klein, Cheat Codes",
Petit Biscuit,"electronic, House, french, france, chill, chillwave, chillout, downtempo, future bass, love at first listen"
Terror Jr,"pop, electropop, indie pop, electronic, female vocalists, synthpop, Hip-Hop, american, cool hair, hip hop"
"Cheat Codes, Kris Kross Amsterdam",
Rihanna,"pop, rnb, female vocalists, dance, Hip-Hop, Rihanna, r&b, hip hop, american, reggae"
The Killers,"indie, indie rock, rock, alternative, alternative rock, american, The Killers, pop, new wave, Post-punk revival"
Vance Joy,"folk, indie, australian, singer-songwriter, acoustic, indie folk, male vocalists, indie pop, pop, australia"
Ed Sheeran,"acoustic, british, singer-songwriter, pop, easy-listening, Grime, folk, male vocalists, indie, alternative"
Kiiara,"pop, electronic, indie, american, alternative, indie pop, female vocalist, female vocalists, trip-hop, electropop"
Mark Ronson,"funk, british, pop, Hip-Hop, dj, soul, electronic, alternative, jazz, hip hop"
Eminem,"rap, Hip-Hop, hip hop, Eminem, pop, american, detroit, male vocalists, slim shady, Gangsta Rap"
Snakehips,"electronic, electronica, indie, instrumental hip-hop, chillwave, Hip-Hop, british, groove bass, nu-disco, chillout"
Isaiah Firebrace,"australian, Eurovision, soul, pop, Eurovision Song Contest, australia, ESC, ESC 2017, eurovision song contest 2017, X factor"
Anne-Marie,"pop, rnb, british, electronic, female vocalists, All, 4, my top songs, anne-marie, deek"
R. Kelly,"rnb, soul, Hip-Hop, rap, hip hop, r&b, male vocalists, american, pop, r kelly"
"JAY-Z, Kanye West","Hip-Hop, rap, Kanye West, jay-z, hip hop, Post-Metal, Sludge, hardcore, polish, american"
Jon Bellion,"hip hop, electronic, Hip-Hop, experimental, american, electropop, singer-songwriter, indie pop, pop rap, male vocalists"
ZAYN,"pop, rnb, british, male vocalists, sexy, singer-songwriter, contemporary rnb, talented, amazing voice, soul"
"DJ Snake, Bipolar Sunshine",
Kanye West,"Hip-Hop, rap, hip hop, rnb, Kanye West, Gay Fish, pop, american, chicago, electronic"
Luke Christopher,"Hip-Hop, soul, pop, rap, rnb, los angeles, american, mixed-hip hop"
Big Sean,"Hip-Hop, rap, hip hop, good music, big sean, Hip Hop/Rap, Michigan, detroit, alternative hip-hop, american"
Chet Faker,"downtempo, Lo-Fi, post-dubstep, smooth, electronic, shoegaze hip-hop, australian, soul, indie, trip-hop"
"The Weeknd, Kendrick Lamar",
Vallis Alps,"dream pop, indie, electronic, chillwave, indie pop, downtempo, pop, indietronica, electronica, electropop"
Niall Horan,"pop, folk, irish, singer-songwriter, male vocalists, one direction, pop rock, cute, sexy, baby"
"Kanye West, Jamie Foxx","Hip-Hop, rap, hip hop, rnb, Kanye West, Gay Fish, pop, american, chicago, electronic"
Foster The People,"indie, indie pop, alternative, american, indie rock, los angeles, electronic, pop, rock, alternative rock"
London Grammar,"indie pop, electronic, indie, female vocalists, british, dream pop, pop, alternative, trip-hop, london"
Kendrick Lamar,"Hip-Hop, rap, west coast, hip hop, compton, California, jazz rap, Conscious Hip Hop, west coast hip hop, american"
David Guetta,"House, dance, electronic, club, techno, french, pop, electro, electro house, David Guetta"
TLC,"rnb, Hip-Hop, female vocalists, pop, soul, 90s, r&b, hip hop, tlc, american"
"G-Eazy, Bebe Rexha","duet, duo, bebe rexha, g-eazy"
"Alok, Bruno Martini, Zeeba",
"Cash Cash, Digital Farm Animals",
Outkast,"Hip-Hop, funk, rap, soul, hip hop, Dirty South, american, southern rap, atlanta, pop"
Macklemore & Ryan Lewis,"Hip-Hop, rap, underground hip-hop, underground rap, seattle, hip hop, american, pop, USA, pop rap"
Flo Rida,"Hip-Hop, rap, hip hop, Dirty South, southern rap, dance, american, rnb, pop, Flo Rida"
Chance the Rapper,"Hip-Hop, rap, hip hop, chicago, jazz rap, pop rap, underground hip-hop, american, cloud rap, acid rap"
AJR,"indie pop, pop, indie, indie rock, american, new york, alt-pop, folk pop, pop rock, horrible"
San Holo,"electronic, trap, future bass, dutch, dance, downtempo, indietronica, beats, dubstep, All"
Galantis,"House, electronic, pop, dance, swedish, EDM, All, electro house, dance-pop, Sweden"
James Bay,"folk, indie, singer-songwriter, british, indie pop, pop, All, indie folk, folk pop, rock"
"Jack Ü, Skrillex, Diplo",
Dua Lipa,"pop, synthpop, electropop, british, female vocalists, dance-pop, nu-disco, dance, Disco, dance pop"
Guy Sebastian,"pop, soul, australian, rnb, Eurovision, male vocalists, r&b, australian idol, Eurovision Song Contest, ESC"
Rob $tone,"Hip-Hop, trap, rap, hip hop, hiphop, american, California, 5 Stars, spotify, Lo-Fi Beat"
Oasis,"britpop, rock, british, alternative, indie, alternative rock, 90s, indie rock, oasis, Manchester"
Passenger,"folk, alternative metal, Melodic Death Metal, Nu Metal, metal, acoustic, british, indie, singer-songwriter, alternative"
OMI,"reggae, electronic, hardcore, dance, jamaican, pop, Gabber, hardcore techno, Mainstream Hardcore, jamaica"
JP Cooper,"soul, pop, folk, singer-songwriter, british, All, indie, Great Britain, english, United Kingdom"
The White Stripes,"rock, alternative rock, alternative, indie, indie rock, Garage Rock, blues rock, blues, american, garage"
Auli'i Cravalho,"Disney, pop, Soundtrack, USA, female vocalists, musical, rnb, hawaii, United States, All"
Bebe Rexha,"pop, female vocalists, electronic, singer-songwriter, alternative, american, indie, USA, electropop, my top songs"
The Rubens,"indie, rock, australian, blues, indie rock, soul, blues rock, alternative rock, alternative, Garage Rock"
"ZHU, Skrillex, THEY.",
"Matoma, Becky Hill",
Vice,"hardcore, hard rock, post-punk, heavy metal, techno, hardcore punk, punk, new wave, Glam Metal, hair metal"
"Marc E. Bassy, G-Eazy",
"Macklemore, Ryan Lewis, Grandmaster Melle Mel",
"Bob Marley & The Wailers, LVNDSCAPE, Bolier",
Golden Features,"australian, deep house, trap, electronic, dark house, House, good, future house, All, australia"
"Drake, Future",
Martin Jensen,"House, dance, tropical house, danish, All, electronic, martin jensen, denmark, si, EDM"
Gnarls Barkley,"funk, soul, Hip-Hop, alternative, hip hop, pop, american, electronic, Neo-Soul, alternative hip-hop"
Chris Brown,"rnb, Hip-Hop, Chris Brown, rap, hip hop, pop, r&b, male vocalists, dance, american"
Wiz Khalifa,"Hip-Hop, rap, hip hop, underground hip-hop, pittsburgh, american, Wiz Khalifa, Hip Hop/Rap, east coast rap, East Coast"
RÜFÜS DU SOL,
"Nicki Minaj, Mike WiLL Made-It",
"Young Thug, Travis Scott",
Red Hot Chili Peppers,"rock, alternative rock, Funk Rock, alternative, funk, american, 90s, Red Hot Chili Peppers, California, punk"
Duke Dumont,"House, electronic, electro, deep house, british, dance, All, Hip-Hop, tech house, techno"
Mark Forster,"german, singer-songwriter, soul, deutsch, male vocalists, pop, germany, indie, Radio, male singer"
Alle Farben,"electronic, minimal, minimal techno, Berlin, german, elektro, techno, All, House, golden gate"
"Sean Paul, Dua Lipa",
Lost Frequencies,"deep house, electronic, dance, House, belgian, pop, All, Belgium, lost frequencies, dj"
ALMA,"pop, finnish, french, france, female vocalists, Eurovision, electronic, Eurovision 2017, finland, electropop"
Pizzera & Jaus,"poprock, deutsch, austrian, Austria, austropop, pizzera und jaus, oestereich"
"Felix Jaehn, ALMA",
"Bonez MC, RAF Camora, Maxwell",
KC Rebell,"Deutschrap, rap, german, Hip-Hop, germany, Gangsta Rap, toy, mixed-deutschrap, strassenrap"
257ers,"rap, Deutschrap, hip hop, german, akk, Hip-Hop, funny, Essen, german hip-hop, zweckreim massaker"
Pentatonix,"a cappella, pop, futuristic, the sing off, a capella, covers, USA, Acapella, american, female vocalists"
James Hersey,"indie, Austria, electropop, electronic, austrian, live gesehen, male vocalists, james hersey"
"Bonez MC, RAF Camora","rap, Hip-Hop, rap auf deutsch, germany"
"Burak Yeter, Danelle Sandoval",
Miami Yacine,"rap, hip hop, german, Hip-Hop, Deutschrap, mixed-deutschrap"
A R I Z O N A,"pop, electronic, synth, indietronica, american, electropop, rock, indie, dance, electronica"
Imany,"soul, jazz, folk, french, singer-songwriter, female vocalists, blues, french soul, folk-soul, pop"
"Lil Kleine, Ronnie Flex",
"RHODES, Felix Jaehn",
Andreas Gabalier,"volksmusik, Austria, Andreas Gabalier, austrian, folk, Schlager, balladen, All, pop, rock"
LP,"indie, rock, synthpop, female vocalists, pop, electronic, indie rock, alternative, american, indie pop"
Seiler und Speer,"austrian, All, austropop, rock, Mundart, folk, comedy"
Wincent Weiss,"pop, german, germany, deutsch, male vocalists, Deutschpop, German Pop, german male vocalists, mixed-pop, dsds"
Disturbed,"Nu Metal, metal, hard rock, alternative, rock, alternative metal, heavy metal, american, Nu-metal, Disturbed"
"Kungs, Jamie N Commons",
"Alle Farben, Younotus",
Jennifer Lopez,"pop, rnb, latin, female vocalists, dance, american, jennifer lopez, latin pop, r&b, sexy"
"Seeb, Jacob Banks",
Robin Schulz,"electronic, dance, german, minimal, House, electro, deep house, germany, dj, Robin Schulz"
Nause,"House, dance, swedish, electronic, 2010s, electro house, Progressive House, All, 00s, backstreet boys"
Hitimpulse,"dance, electronic, EDM, trap"
Max Giesinger,"pop, german, singer-songwriter, acoustic, germany, indie rock, deutsch, DE, acoustic pop, male vocalists"
"Stereoact, Kerstin Ott",
The Strumbellas,"folk, indie rock, country, Canadian, indie, folk rock, Alt-country, indie folk, rock, canada"
"Yung Hurn, RIN",
Alvaro Soler,"pop, latin, spain, spanish, latin pop, the worst thing ever to happen to music, male vocalists, alternative, Pop Latino, not my cup of tea"
Spice Girls,"pop, 90s, british, female vocalists, dance, Spice Girls, Girl Groups, teen pop, dance-pop, britpop"
"Martin Solveig, Ina Wroldsen",
"Bonez MC, RAF Camora, Gzuz",
"Dimitri Vegas & Like Mike, Diplo, Deb’s Daughter",
Alligatoah,"rap, Deutschrap, hip hop, german, Hip-Hop, der beste rapper der welt, deutsch, German hip hop, underground, hiphop"
Journey,"classic rock, rock, hard rock, 80s, Progressive rock, AOR, american, soft rock, journey, arena rock"
Deorro,"House, dance, Progressive House, electronic, club, american, electro house, electro, Deorro, melbourne bounce"
Robbie Williams,"pop, britpop, british, rock, male vocalists, pop rock, robbie williams, singer-songwriter, 90s, alternative"
Helene Fischer,"Helene Fischer, Schlager, Deutsche Schlager, deutsch, german, Und morgen frueh kuess ich Dich wach, female vocalists, pop, germany, volksmusik"
State of Sound,"dub, swedish, dance, alternative, EDM, drum'n'bass, pop, synthpop, state of sound, tropical house"
KREAM,"House, norwegian, dance, electronic, EDM, good, Norway, Korean, underground hip-hop, k-pop"
OneRepublic,"pop rock, rock, alternative, alternative rock, indie, pop, american, male vocalists, piano rock, OneRepublic"
"Gzuz, LX, Bonez MC, Maxwell",
